"","AU","AB","TI","SO","DT","PD","PY","DI","WC","UT"
"SKEFFINGTON MS, 2006, BIOL CONSERV","SKEFFINGTON MS;MORAN J;O CONNOR A;REGAN E;COXON CE;SCOTT NE;GORMALLY M","TURLOUGHS ARE KARST WETLAND ECOSYSTEMS THAT ARE VIRTUALLY UNIQUE TO IRELAND. FLOODING ANNUALLY IN AUTUMN THROUGH SPRINGS AND FISSURES IN THE UNDERLYING LIMESTONE AND DRAINING IN THE SPRINGTIME, OFTEN THROUGH THE SAME FISSURES OR SWALLOW-HOLES, THEY HAVE BEEN DESCRIBED AS 'TEMPORAL ECOTONES'. OVER 300 HAVE BEEN DOCUMENTED. THEY ARE PRIORITY HABITATS IN THE EU HABITATS DIRECTIVE AND SUPPORT A VARIETY OF WET GRASSLAND AND FEN TYPE VEGETATION. THOUGH THE VEGETATION HAS BEEN RECORDED AND MAPPED FOR OVER 80 TURLOUGHS, RECORDS FOR INVERTEBRATES ARE MORE SPORADIC. CHARACTERISTIC SPECIES INCLUDE SOME AQUATIC SPECIES-OFTEN BENEFITING FROM THE ABSENCE OF FISH-, AND MANY WETLAND TERRESTRIAL SPECIES, INCLUDING CARABID BEETLES THAT ARE RARE ON A EUROPEAN SCALE. DUE TO THEIR SHALLOW NATURE AND THE FULL VEGETATION COVER OF THE BASIN, TURLOUGHS CAN HOST INTERNATIONALLY SIGNIFICANT NUMBERS OF VISITING WINTER WILDFOWL, PARTICULARLY WHOOPER SWANS. THE VARIETY OF PLANT AND INVERTEBRATE COMMUNITIES BETWEEN TURLOUGHS IS PRIMARILY DUE TO DIFFERENT HYDROGEOMORPHOLOGICAL CHARACTERISTICS, BUT ALSO DEPENDS ON THE RANGE OF GRAZING PRACTICES ON TURLOUGHS. SINCE THESE OFTEN VARY WITHIN A TURLOUGH BASIN, THIS HELPS MAINTAIN WITHIN-TURLOUGH BIODIVERSITY. THE MAIN THREAT TO TURLOUGHS IN THE PAST WAS DRAINAGE, BUT POLLUTION BY NUTRIENTS IS ALSO NOW POTENTIALLY DETRIMENTAL. HOWEVER, A MORE RECENT AND IMPORTANT THREAT MAY BE THE CESSATION OF FARMING WITHIN TURLOUGHS. AS POTENTIALLY THREATENED WETLANDS OF EUROPEAN IMPORTANCE, TURLOUGHS REQUIRE A FULL INVENTORY OF THEIR BIODIVERSITY AND THE FACTORS AFFECTING IT. THE COLLATION HERE OF ALL LITERATURE CONCERNING TURLOUGHS WILL PROVIDE A BASIS FOR AN INTEGRATED APPROACH TO FUTURE RESEARCH ON TURLOUGHS THAT IS ESSENTIAL FOR A FULL UNDERSTANDING OF THESE COMPLEX ECOSYSTEMS. (C) 2006 ELSEVIER LTD. ALL RIGHTS RESERVED.","TTIRLOUGHS - IRELAND'S UNIQUE WETLAND HABITAT","BIOLOGICAL CONSERVATION","REVIEW","DEC",2006,"10.1016/j.biocon.2006.06.019","BIODIVERSITY CONSERVATION; ECOLOGY; ENVIRONMENTAL SCIENCES","WOS:000242797500001"
"WALLER MP, 1993, NEW PHYTOL","WALLER MP","POLLEN DATA, PLANT MACROFOSSIL REMAINS AND LITHOSTRATIGRAPHY ARE USED TO RECONSTRUCT FLANDRIAN VEGETATIONAL HISTORY FROM A COASTAL SITE IN SOUTH-EASTERN ENGLAND. THE RECORD AT THIS SITE, PANNEL BRIDGE IN EAST SUSSEX, EXTENDS BACK TO C. 10000 BP AND IS THE MOST COMPLETE SO FAR OBTAINED FROM THIS REGION. THE THIRTEEN POLLEN ASSEMBLAGES ZONES DEFINED REFLECT, IN PART, THE COMPLEX DEVELOPMENT OF THE SITE. PRIOR TO C. 8500 BP, WETLAND IN THE PANNEL VALLEY WAS LOCALIZED AROUND THE SITE. BETWEEN C. 8500 AND C. 6000 BP, IN RESPONSE TO CHANGES IN COASTAL CONFIGURATION, SUCH AREAS UNDER-WENT EXPANSION AND THE VALLEY FLOOR WAS OCCUPIED ALTERNATELY BY SEDGE FEN AND ALNUS CARR. A PERIOD OF STABILITY FOLLOWED, WITH ALNUS-DOMINATED COMMUNITIES PREVAILING FOR C. 2000 YR. FROM C. 4000 TO C. 2200 BP LOCAL CONDITIONS WERE MORE OPEN WITH CYPERACEAE AND SUBSEQUENTLY MYRICA THE DOMINANT WETLAND TYPES. ALNUS CARR BECAME RE-ESTABLISHED C. 2200 BP. THE VEGETATIONAL HISTORY OF ADJACENT DRYLAND AREAS IS OBSCURED BY THE CHANGING LOCAL CONDITIONS AND NATURE OF THE DEPOSITS INVESTIGATED. THE PROBLEMS OF RECONSTRUCTING PAST VEGETATION FROM COASTAL PEATS ARE EXPLORED. AMONGST THESE ARE THE DETERMINATION OF THE POLLEN SOURCE AREA, ESTABLISHING AN ENVIRONMENT OF ORIGIN FOR MANY HERB TYPES, AND DISTINGUISHING THE PROCESSES CONTROLLING WETLAND VEGETATIONAL CHANGE. THE DISCUSSION FOCUSES ON THE ARRIVAL AND EXPANSION OF ARBOREAL TAXA IN THE EARLY FLANDRIAN AND HUMAN ACTIVITY. UNUSUALLY, ALNUS IS PRESENT IN THE POLLEN AND MACROFOSSIL RECORD FROM C. 10000 BP ONWARDS. IN DRYLAND AREAS, AFTER AN INITIAL PINUS, BETULA PHASE, CORYLUS POPULATIONS EXPANDED C. 9500 BP, QUERCUS AND ULMUS BECAME WOODLAND COMPONENTS FROM C. 9100 BP AND C. 8400 BP ONWARDS RESPECTIVELY. POLLEN VALUES FOR TILIA INCREASED C. 7000 BP AND FRAXINUS C. 5900 BP THOUGH BOTH OF THESE TAXA WERE PROBABLY LOCALLY PRESENT EARLIER. OPENINGS IN THE FOREST CANOPY APPEAR TO HAVE PERSISTED AFTER THE ARRIVAL OF THE DECIDUOUS TREES, POSSIBLY AS A CONSEQUENCE OF HUMAN ACTIVITY DURING THE MESOLITHIC. THERE IS SOME PALYNOLOGICAL EVIDENCE FOR HUMAN PRESENCE ACCOMPANYING THE ELM DECLINE, THOUGH SUBSTANTIAL CLEARANCE DID NOT OCCUR UNTIL THE DECLINE IN TILIA, C. 3700 BP. THIS, AND A SUBSEQUENT PHASE OF DISTURBANCE C. 3200 BP, APPEAR NOT TO HAVE BEEN FOLLOWED BY PERIODS OF INTENSE HUMAN ACTIVITY. WOODLAND REGENERATION MAY HAVE OCCURRED C. 2000 BP.","FLANDRIAN VEGETATIONAL HISTORY OF SOUTH-EASTERN ENGLAND - POLLEN DATA FROM PANNEL BRIDGE, EAST SUSSEX","NEW PHYTOLOGIST","REVIEW","JUN",1993,"10.1111/j.1469-8137.1993.tb03825.x","PLANT SCIENCES","WOS:A1993LL72600017"
"BOZKURT S, 2001, EARTH-SCI REV","BOZKURT S;LUCISANO M;MORENO L;NERETNIEKS I","A SURVEY OF THE EXISTING STUDIES ON PEAT AND ITS DECOMPOSITION PROCESSES IS PRESENTED WITH THE AIM TO CHARACTERISE THE LONG-TERM BEHAVIOUR OF PEAT ACCUMULATING SYSTEMS. THE CHEMICAL AND PHYSICAL CHARACTERISTICS OF PEAT TOGETHER WITH ITS ACCUMULATION AND DECAY PROCESSES HAVE BEEN ANALYSED. PEAT IS AN ACIDIC MIXTURE OF DEAD AND DECOMPOSED. MAINLY VEGETABLE, MATTER FORMED IN BOGGY AREAS; IT IS THE YOUNGEST AND LEAST ALTERED COMPONENT OF THE COMBUSTIBLE ROCKS AND IS CHARACTERISED BY THE LOWEST CONTENT OF FIXED CARBON AND THE HIGHEST CONTENT OF VOLATILE CONSTITUENTS. PEAT IS FORMED BY DEGENERATION PROCESSES UNDER EXCLUSION OF ATMOSPHERIC OXYGEN BY THE ACTION OF WATER; THE SPEED OF FORMATION DEPENDS UPON THE CLIMATIC AND ENVIRONMENTAL CONDITIONS. IN MOST PEATLANDS TWO LAYERS CAN BE CHARACTERISED: THE AEROBIC ACROTELM AND THE ANAEROBIC CATOTELM, THEIR RELATIVE IMPORTANCE BEING CONTROLLED MAINLY BY THE POSITION OF THE WATER TABLE. IN THE ACROTELM THE AEROBIC PROCESSES ARE RESPONSIBLE FOR THE LOSS OF UP TO 90% OF THE ORIGINAL MASS, DEGENERATION IN THE ACIDIC AND ANAEROBIC CATOTELM IS STILL IMPERFECTLY CHARACTERISED EVEN THOUGH THE CATOTELM IS THE REAL SITE OF PEAT ACCUMULATION. MOST OF THE RECENT LITERATURE CONSIDERS PEAT AS COMPOSED OF EASILY DEGRADABLE COMPOUNDS, E.G. POLYSACCHARIDES. AND RECALCITRANT MATTER (LIGNIN AND COMPLEX AROMATICS). THE LONE-TERM DESTINY OF PEAT HAS NOT BEEN SUFFICIENTLY CHARACTERISED: ALTHOUGH IN A LARGE MAJORITY OF CASES IT SEEMS PROBABLE THAT PEAT DECOMPOSES COMPLETELY (EVEN THOUGH SLOWLY) PROVIDED THAT IT IS GIVEN A SUFFICIENTLY LONG RESIDENCE RIME IN THE CATOTELM, SOME CASES CAN STILL BE INTERPRETED AS EXAMPLES OF SIMPLE ACCUMULATION. THE RATES OF INFLUX OF OXYGEN AND HENCE THE DEGRADATION OF ORGANIC MATTER INTO BOTH SATURATED AND PARTIALLY SATURATED PEAT HAVE BEEN ESTIMATED. THE DEPLETION RATE IS ABOUT 4500 G M(-1) YEAR(-1) FOR PARTIALLY SATURATED PEAT. THE AVERAGE DEPLETION RATE OF THE PEAT FOR THIS CASE WILL THEN BE SUCH THAT IT WILL TAKE ON THE ORDER OF 5 TO 50 YEARS TO DEGRADE HALF OF THE ORGANICS IN A 10 CM PARTIALLY SATURATED LAYER. FOR THE WATER-SATURATED CASE THE DEPLETION RATE VARIES BETWEEN 8 AND 12 G M(-2) YEAR(-1), WHICH IS CONSIDERABLY LOWER THAN IN THE PARTIALLY SATURATED REGION. THE MODELS USED TO ANALYSE THE FIELD AND LABORATORY DATA ON GENERATION, DIFFUSION AND EMISSION OF METHANE AND CARBON DIOXIDE INDICATE THAT LABORATORY DATA AND FIELD OBSERVATIONS AGREE REASONABLY WELL. IT IS SUGGESTED THAT PEAT-ACCUMULATING ECOSYSTEMS MAY BE VALUABLE NATURAL ANALOGUES FOR THE STUDY OF THE LONG-TERM DESTINY OF INDUSTRIAL AND MUNICIPAL SOLID WASTES. ACCURATE STUDIES OF ACTIVE MIRES TOGETHER WITH AN AD HOC REVIEW OF THE EXISTING LITERATURE GIVE VALUABLE INSIGHTS IN THIS PROBLEM. PEATLANDS MIGHT THEN BE CONSIDERED AS ORGANIC WASTE DEPOSITION EXPERIMENTS LASTING UP TO SEVERAL THOUSANDS YEARS. (C) 2001 ELSEVIER SCIENCE B.V. ALL RIGHTS RESERVED.","PEAT AS A POTENTIAL ANALOGUE FOR THE LONG-TERM EVOLUTION IN LANDFILLS","EARTH-SCIENCE REVIEWS","REVIEW","MAR",2001,"10.1016/S0012-8252(00)00036-2","GEOSCIENCES, MULTIDISCIPLINARY","WOS:000168159000003"
"LASHOF DA, 1997, ANNU REV ENERG ENV","LASHOF DA;DEANGELO BJ;SALESKA SR;HARTE J","ANTHROPOGENIC GREENHOUSE GASES ARE EXPECTED TO INDUCE CHANGES IN GLOBAL CLIMATE THAT CAN ALTER ECOSYSTEMS IN WAYS THAT, IN TURN, MAY FURTHER AFFECT CLIMATE. SUCH CLIMATE-ECOSYSTEM INTERACTIONS CAN GENERATE EITHER POSITIVE OR NEGATIVE FEEDBACKS TO THE CLIMATE SYSTEM, THEREBY EITHER ENHANCING OR DIMINISHING THE MAGNITUDE OF GLOBAL CLIMATE CHANGE. IMPORTANT TERRESTRIAL FEEDBACK MECHANISMS INCLUDE CO2 FERTILIZATION (NEGATIVE FEEDBACKS), CARBON STORAGE IN VEGETATION AND SOILS (POSITIVE AND NEGATIVE FEEDBACKS), VEGETATION ALBEDO (POSITIVE FEEDBACKS), AND PEATLAND METHANE EMISSIONS (POSITIVE AND NEGATIVE FEEDBACKS). WHILE THE PROCESSES INVOLVED ARE COMPLEX, NOT READILY QUANTIFIABLE, AND DEMONSTRATE BOTH POSITIVE AND NEGATIVE FEEDBACK POTENTIAL, WE CONCLUDE THAT THE COMBINED EFFECT OF THE FEEDBACK MECHANISMS REVIEWED HERE WILL LIKELY AMPLIFY CLIMATE CHANGE RELATIVE TO CURRENT PROJECTIONS THAT HAVE NOT YET ADEQUATELY INCORPORATED THESE MECHANISMS.","TERRESTRIAL ECOSYSTEM FEEDBACKS TO GLOBAL CLIMATE CHANGE","ANNUAL REVIEW OF ENERGY AND THE ENVIRONMENT","REVIEW",NA,1997,"10.1146/annurev.energy.22.1.75","ENERGY & FUELS; ENGINEERING, ENVIRONMENTAL","WOS:A1997YK27600005"
"DABROS A, 2018, ENVIRON REV","DABROS A;PYPER M;CASTILLA G","THE OIL AND GAS INDUSTRY HAS GROWN SIGNIFICANTLY THROUGHOUT THE BOREAL AND ARCTIC ECOSYSTEMS OF NORTH AMERICA. A MAJOR FEATURE OF THE ECOLOGICAL FOOTPRINT OF OIL AND GAS EXPLORATION IS SEISMIC LINES-NARROW CORRIDORS USED TO TRANSPORT AND DEPLOY GEOPHYSICAL SURVEY EQUIPMENT. THESE LINES, WHICH TRAVERSE FORESTS, TUNDRA, UPLANDS, AND PEATLANDS, WERE HISTORICALLY UP TO 10 M WIDE. OVER THE PAST DECADE, SEISMIC LINES HAVE DECREASED IN WIDTH (IN SOME CASES DOWN TO 1.75-3M); HOWEVER, THEIR DENSITY HAS INCREASED DRASTICALLY AND THEIR CONSTRUCTION IS EXPECTED TO CONTINUE IN REGIONS OF CANADA AND THE UNITED STATES THAT ARE RICH IN OIL AND GAS RESOURCES. WE EXAMINE THE LITERATURE RELATED TO THE ENVIRONMENTAL IMPACTS OF, AND RESTORATION AND RECLAMATION EFFORTS ASSOCIATED WITH, SEISMIC LINES IN THE BOREAL AND ARCTIC ECOSYSTEMS OF NORTH AMERICA. WITH RESPECT TO CONVENTIONAL SEISMIC LINES, NUMEROUS STUDIES REPORT SIGNIFICANT AND PERSISTENT ENVIRONMENTAL CHANGES ALONG THESE LINES AND SLOW RECOVERY OF VEGETATION THAT TRANSLATES INTO A LASTING FRAGMENTATION OF THE LANDSCAPE. THIS FRAGMENTATION HAS MANY RAMIFICATIONS FOR BIODIVERSITY AND ECOSYSTEM PROCESSES, INCLUDING SIGNIFICANT IMPLICATIONS FOR THREATENED WOODLAND CARIBOU HERDS. WHILE MODERN, LOW-IMPACT SEISMIC LINES HAVE COMPARATIVELY LOWER ECOLOGICAL EFFECTS AT THE SITE-LEVEL, THEIR HIGH DENSITY AND ASSOCIATED POTENTIAL EDGE EFFECTS SUGGEST THAT THEIR ACTUAL ENVIRONMENTAL IMPACT MAY BE UNDERESTIMATED. SEISMIC LINE RESTORATION IS A CRITICAL ASPECT OF FUTURE INTEGRATED LANDSCAPE MANAGEMENT IN HYDROCARBON-RICH REGIONS OF THE BOREAL-ARCTIC, AND IF WIDELY APPLIED, HAS THE POTENTIAL TO BENEFIT A WIDE RANGE OF SPECIES AND MAINTAIN OR RE-ESTABLISH KEY ECOSYSTEM SERVICES SUCH AS CARBON SEQUESTRATION AND BIODIVERSITY.","SEISMIC LINES IN THE BOREAL AND ARCTIC ECOSYSTEMS OF NORTH AMERICA: ENVIRONMENTAL IMPACTS, CHALLENGES, AND OPPORTUNITIES","ENVIRONMENTAL REVIEWS","REVIEW","JUN",2018,"10.1139/er-2017-0080","ENVIRONMENTAL SCIENCES","WOS:000433097600008"
"GASTALDO RA, 2009, PALAIOS","GASTALDO RA;PURKYNOVA E;SIMUNEK Z;SCHMITZ MD","THE SERPUKHOVIAN (NAMURIAN A) STRATIGRAPHY OF THE OSTRAVA FORMATION, UPPER SILESIAN COAL BASIN, CZECH REPUBLIC, CONSISTS OF COAL-BEARING PARALIC SEDIMENTS UNDERLAIN BY MARINE DEPOSITS IN A CYCLOTHEMIC NATURE SIMILAR TO THOSE IN THE PENNSYLVANIAN OF EURAMERICA. THE THICKNESS OF THE FORMATION EXCEEDS 3000 M, IN WHICH >170 COALS ARE IDENTIFIED IN A FORELAND BASIN SETTING. FIFTY-FIVE GENETIC CYCLES ARE IDENTIFIED IN THE PRESENT STUDY, USING TRANSGRESSIONAL EROSIONAL SURFACES AS LOWER AND UPPER BOUNDARIES. TERRESTRIAL PLANT-MACROFOSSIL ASSEMBLAGES ARE PRESERVED WITHIN EACH CYCLE, MOSTLY ASSOCIATED WITH COALS, AND THESE REPRESENT A SAMPLING OF THE COASTAL PLAIN VEGETATION. NEW HIGH-PRECISION ISOTOPE DILUTION-THERMAL IONIZATION MASS SPECTROMETRY U-PB AGES ON ZIRCONS FROM TONSTEINS OF TWO COALS PROVIDE CHRONOMETRIC CONSTRAINTS FOR THE SERPUKHOVIAN. UNWEIGHTED PAIR GROUP METHOD WITH ARITHMETIC MEAN CLUSTERING AND BAYESIAN STATISTICAL CLASSIFICATION GROUP MACROFLORAL ASSEMBLAGES INTO FOUR DISTINCT STRATIGRAPHIC CLUSTERS, WITH ASSEMBLAGES PERSISTING FOR <18 CYCLES BEFORE COMPOSITIONAL CHANGE. CYCLE DURATION, BASED ON LUDMILA (328.84+/-0.16 MA) AND KAREL (328.01+/-0.08 MAL TONSTEINS, OVERLAPS THE SHORT-PERIOD (100 KYR) ECCENTRICITY CYCLE AT THE 95% CONFIDENCE INTERVAL. THESE DATES PUSH THE BEGINNING OF THE SERPUKHOVIAN SEVERAL MILLION YEARS DEEPER IN TIME. AN ESTIMATE FOR THE VISEAN-SERPUKHOVIAN BOUNDARY IS PROPOSED AT SIMILAR TO 330 MA. LATE MISSISSIPPIAN WETLAND ECOSYSTEMS PERSISTED FOR >1.8 MILLION YEARS BEFORE REGIONAL PERTURBATION, EXTIRPATION, OR EXTINCTION OF TAXA OCCURRED. SIGNIFICANT CHANGES IN THE COMPOSITION OF MACROFLORAL CLUSTERS OCCUR ACROSS MAJOR MARINE INTERVALS. THESE RESULTS ACCORD WITH OTHER ESTIMATES OF CARBONIFEROUS TROPICAL WETLAND COMMUNITY PERSISTENCE. HENCE, VEGETATIONAL PERSISTENCE WAS CHARACTERISTIC OF PEAT-ACCUMULATING AND MINERAL-SUBSTRATE WETLAND ECOSYSTEMS BEGINNING IN THE LATE MISSISSIPPIAN, WHEN THERE IS EVIDENCE FOR THE FIRST APPEARANCE OF EUSTATICALLY CONTROLLED CYCLOTHEMS DURING THE BUILDUP OF GONDWANAN GLACIATION.","ECOLOGICAL PERSISTENCE IN THE LATE MISSISSIPPIAN (SERPUKHOVIAN, NAMURIAN A) MEGAFLORAL RECORD OF THE UPPER SILESIAN BASIN, CZECH REPUBLIC","PALAIOS","REVIEW","MAY-JUN",2009,"10.2110/palo.2008.p08-084r","GEOLOGY; PALEONTOLOGY","WOS:000266707400009"
"LOISEL J, 2017, EARTH-SCI REV","LOISEL J;VAN BELLEN S;PELLETIER L;TALBOT J;HUGELIUS G;KARRAN D;YU ZC;NICHOLS J;HOLMQUIST J","IN THIS REVIEW PAPER, WE IDENTIFY AND ADDRESS KEY UNCERTAINTIES RELATED TO FOUR LOCAL AND GLOBAL CONTROLS OF HOLOCENE NORTHERN PEATLAND CARBON STOCKS AND FLUXES. FIRST, WE PROVIDE UP-TO-DATE ESTIMATES OF THE CURRENT NORTHERN PEATLAND AREA (3.2 M KM(2)) AND PROPOSE A NOVEL APPROACH TO RECONSTRUCT CHANGES IN THE NORTHERN PEATLAND AREA OVER TIME (SECTION 2). SECOND, WE REVIEW THE KEY METHODS AND MODELS THAT HAVE BEEN USED TO QUANTIFY TOTAL CARBON STOCKS AND METHANE EMISSIONS OVER TIME AT THE HEMISPHERIC SCALE, AND OFFER NEW RESEARCH DIRECTIONS TO IMPROVE THESE CALCULATIONS (SECTION 3). OUR MAIN PROPOSED IMPROVEMENT RELATES TO ALLOCATING DIFFERENT CARBON STOCK AND EMISSION VALUES FOR EACH OF THE TWO DOMINANT VEGETATION ASSEMBLAGES (SEDGE AND BROWN MOSS-DOMINATED VS. SPHAGNUM-DOMINATED PEAT). THIRD, WE DISCUSS AND QUANTIFY THE IMPORTANCE OF BASIN HETEROGENEITY IN ESTIMATING PEAT VOLUME AT THE LOCAL SCALE (SECTION 4.1). WE ALSO HIGHLIGHT THE IMPORTANCE OF AGE MODEL SELECTION WHEN RECONSTRUCTING CARBON ACCUMULATION RATES FROM A PEAT CORE (SECTION 4.2). LASTLY, WE INTRODUCE THE ROLE OF BIOGEOMORPHOLOGICAL AGENTS SUCH AS BEAVER ACTIVITY IN CONTROLLING CARBON DYNAMICS (SECTION 5.1) AND REVIEW THE NEWEST RESEARCH RELATED TO PERMAFROST THAW (SECTION 5.2) AND PEAT FIRE (SECTION 5.3) UNDER CLIMATE CHANGE. OVERALL, THIS REVIEW SUMMARIZES NEW INFORMATION FROM A BROAD RANGE OF PEAT-CARBON STUDIES, PROVIDES NOVEL ANALYSIS OF HEMISPHERIC-SCALE PALEO DATASETS, AND PROPOSES NEW INSIGHTS ON HOW TO TRANSLATE PEAT-CORE DATA INTO CARBON FLUXES. IT ALSO IDENTIFIES CRITICAL DATA GAPS AND RESEARCH PRIORITIES, AND MANY WAYS TO CONSIDER AND ADDRESS THEM. (C) 2016 ELSEVIER B.V. ALL RIGHTS RESERVED.","INSIGHTS AND ISSUES WITH ESTIMATING NORTHERN PEATLAND CARBON STOCKS AND FLUXES SINCE THE LAST GLACIAL MAXIMUM","EARTH-SCIENCE REVIEWS","REVIEW","FEB",2017,"10.1016/j.earscirev.2016.12.001","GEOSCIENCES, MULTIDISCIPLINARY","WOS:000394395800002"
"WEBER TKD, 2017, WATER RESOUR RES","WEBER TKD;IDEN SC;DURNER W","IN OMBROTROPHIC PEATLANDS, THE MOISTURE CONTENT OF THE VADOSE ZONE (ACROTELM) CONTROLS OXYGEN DIFFUSION RATES, REDOX STATE, AND THE TURNOVER OF ORGANIC MATTER. WHETHER PEATLANDS ACT AS SINKS OR SOURCES OF ATMOSPHERIC CARBON THUS RELIES ON VARIABLY SATURATED FLOW PROCESSES. THE RICHARDS EQUATION IS THE STANDARD MODEL FOR WATER FLOW IN SOILS, BUT IT IS NOT CLEAR WHETHER IT CAN BE APPLIED TO SIMULATE WATER FLOW IN LIVE SPHAGNUM MOSS. TRANSIENT LABORATORY EVAPORATION EXPERIMENTS WERE CONDUCTED TO OBSERVE EVAPORATIVE WATER FLUXES IN THE ACROTELM, CONTAINING LIVING SPHAGNUM MOSS, AND A DEEPER LAYER CONTAINING DECOMPOSED MOSS PEAT. THE EXPERIMENTAL DATA WERE EVALUATED BY INVERSE MODELING USING THE RICHARDS EQUATION AS PROCESS MODEL FOR VARIABLY-SATURATED FLOW. IT WAS TESTED WHETHER WATER FLUXES AND TIME SERIES OF MEASURED PRESSURE HEADS DURING EVAPORATION COULD BE SIMULATED. THE RESULTS SHOWED THAT THE MEASUREMENTS COULD BE MATCHED VERY WELL PROVIDING THE HYDRAULIC PROPERTIES ARE REPRESENTED BY A SUITABLE MODEL. FOR THIS, A TRIMODAL PARAMETRIZATION OF THE UNDERLYING PORE-SIZE DISTRIBUTION WAS NECESSARY WHICH REFLECTS THREE DISTINCT PORE SYSTEMS OF THE SPHAGNUM CONSTITUTED BY INTER-, INTRA-, AND INNER-PLANT WATER. WHILE THE TRADITIONAL VAN GENUCHTEN-MUALEM MODEL LED TO GREAT DISCREPANCIES, THE PHYSICALLY MORE COMPREHENSIVE PETERS-DURNER-IDEN MODEL WHICH ACCOUNTS FOR CAPILLARY AND NONCAPILLARY FLOW, LED TO A MORE CONSISTENT DESCRIPTION OF THE OBSERVATIONS. WE CONCLUDE THAT THE RICHARDS EQUATION IS A VALID PROCESS DESCRIPTION FOR VARIABLY SATURATED MOISTURE FLUXES OVER A WIDE PRESSURE RANGE IN PEATLANDS SUPPORTING THE CONCEPTUALIZATION OF THE LIVE MOSS AS PART OF THE VADOSE ZONE.","UNSATURATED HYDRAULIC PROPERTIES OF SPHAGNUM MOSS AND PEAT REVEAL TRIMODAL PORE-SIZE DISTRIBUTIONS","WATER RESOURCES RESEARCH","REVIEW","JAN",2017,"10.1002/2016WR019707","ENVIRONMENTAL SCIENCES; LIMNOLOGY; WATER RESOURCES","WOS:000394911200025"
"ELLEBJERG SM, 2008, ADV ECOL RES","ELLEBJERG SM;TAMSTORF MP;ILLERIS L;MICHELSEN A;HANSEN BU","RESULTS FROM MONITORING AND EXPERIMENTAL STUDIES REPRESENTING VARIOUS ELEMENTS OF CLIMATIC CHANGE ARE PRESENTED TO EVALUATE THE CONCURRENT DYNAMICS OF VEGETATION TYPES AS WELL AS SPECIES-SPECIFIC RESPONSES TO CLIMATIC VARIATIONS. THE STUDIES WERE CARRIED OUT IN THE HIGH-ARCTIC VALLEY OF ZACKENBERGDALEN IN NORTHEAST GREENLAND. VEGETATION TYPE DYNAMICS AND LAND SURFACE PHENOLOGY WERE STUDIED THROUGH THE USE OF HAND-HELD SENSORS OF REFLECTION OF VEGETATION, FROM WHICH THE FAR RED NORMALISED DIFFERENCE VEGETATION INDEX (NDVI-FR) CAN BE INFERRED. FURTHERMORE, SPECIES-SPECIFIC DYNAMICS WERE STUDIED THROUGH MEASURES OF TIMING AND MAGNITUDE OF FLOWERING THROUGH A PERIOD OF 10 YEARS. TIME OF SNOWMELT AND TEMPERATURE WERE THE MAJOR CONTROLLING FACTORS FOR THE TIMING OF THE PHENOLOGY IN THE SIX VEGETATION TYPES: FELL-FIELD, DRYAS HEATH, CASSIOPE HEATH, SALIX HEATH, GRASSLAND, AND FEN. SNOWMELT HAD A LINEAR POSITIVE EFFECT ON THE TIMING OF THE MAXIMUM OF THE GROWING SEASON, WITH LATE SNOWMELT, CAUSING A LATER OCCURRENCE OF THE MAXIMUM. WHILE HIGHER SUMMED TEMPERATURES DURING THE GREEN-UP PERIOD (TIME FROM SNOWMELT TO MAXIMUM) ALSO WAS SHOWN TO BE POSITIVELY RELATED TO THE TIMING OF THE MAXIMUM, ENHANCED FLOWER PRODUCTION SEEMED TO CAUSE LOWER VEGETATIVE BIOMASS PRODUCTION AND HENCE A LATER MAXIMUM. THE SEASONAL VEGETATIVE PRODUCTION, EXPRESSED AS THE SEASONAL INTEGRATED NDVI-FR (SINDVI), HAD A LINEAR NEGATIVE RELATION WITH THE TEMPERATURES DURING THE PREVIOUS SUMMER. THIS WAS PROBABLY DUE TO HIGHER TEMPERATURES CAUSING MORE FLOWERS THE FOLLOWING YEAR, LEADING TO A LOWER NDVI-FR. A STRONG NEGATIVE TREND IN MAXIMUM NDVI-FR IS DOCUMENTED IN ALL SIX VEGETATION TYPES DURING THE YEARS FROM 1999 TO 2006 WITH A DECREASE OF 0.01 NDVI-FR PER YEAR. THE MAIN REASON COULD BE DRYING OF THE UPPER SOIL LAYERS DUE TO EARLIER SNOWMELT AND HIGHER EVAPOTRANSPIRATION DURING RECENT YEARS. SOME GENERAL TRENDS IN PHENOLOGICAL CHARACTERISTICS WERE RECOGNISED, ALTHOUGH RESPONSES VARIED AMONG SPECIES. THE TIME OF SNOW DISAPPEARANCE WAS THE MAIN DETERMINANT FOR ONSET OF FLOWERING. SHRUBS SEEMED TO BE SUPERIOR IN TAKING ADVANTAGE OF AN EARLY SNOWMELT WITH RESPECT TO INITIATION OF FLOWERING. IN ADDITION, MOST SPECIES DEVELOPED FLOWERS AND SEED CAPSULES FASTER WHEN TEMPERATURES INCREASED. MORE FLOWERS INCREASE THE CHANCE OF CROSS-POLLINATION AND HENCE, OFFER AN INCREASED POSSIBILITY FOR SEXUAL REPRODUCTION AND GENETIC EXCHANGE. MOST SPECIES INCREASED THE NUMBER OF FLOWERS IN YEARS FOLLOWING A WARM GROWING SEASON IN THE PREVIOUS YEAR, ALTHOUGH SOME SPECIES ALSO DEPENDED ON CLIMATIC CONDITIONS IN THE CURRENT YEAR PRIOR TO ONSET OF FLOWERING. EXPERIMENTAL MANIPULATIONS OF GROWING SEASON LENGTH, TEMPERATURE AND INCOMING RADIATION IN PLOTS WITH THE DOMINANT DWARF SHRUB, WHITE ARCTIC BELL-HEATHER CASSIOPE TETRAGONA, CONFIRMED THAT THIS SPECIES SIGNIFICANTLY REDUCED FLOWERING WHEN SUBJECTED TO SHADING OR REDUCED GROWING SEASON LENGTH. BASED ON CURRENT PREDICTIONS FOR CLIMATIC CHANGES IN THE ZACKENBERG AREA (STENDEL ET AL., 2008, THIS VOLUME), IT IS EXPECTED THAT THE PLANT SPECIES CURRENTLY PRESENT WILL BE ABLE TO PUT MORE EFFORT IN SEXUAL REPRODUCTION, THUS ENSURING INCREASED SPECIES ADAPTEDNESS TO CHANGING CLIMATE THROUGH ENHANCED GENETIC VARIANCE. HOWEVER, THIS IS PROVIDED THAT SEEDS ARE ABLE TO GERMINATE, THAT SPECIES ARE NOT OUT-COMPETED BY FASTER GROWING AND CANOPY-FORMING INVADING SPECIES, AND THAT SPECIES ARE ABLE TO CONTINUE FLOWERING EVEN UNDER REDUCED LIGHT LEVELS CAUSED BY AN INCREASED CLOUD-COVER.","INTER-ANNUAL VARIABILITY AND CONTROLS OF PLANT PHENOLOGY AND PRODUCTIVITY AT ZACKENBERG","ADVANCES IN ECOLOGICAL RESEARCH, VOL 40: HIGH-ARCTIC ECOSYSTEM DYNAMICS IN A CHANGING CLIMATE","REVIEW",NA,2008,"10.1016/S0065-2504(07)00011-6","ECOLOGY","WOS:000256528000011"
"ELBERLING B, 2008, ADV ECOL RES-a","ELBERLING B;NORDSTROM C;GRONDAHL L;SOGAARD H;FRIBORG T;CHRISTENSEN TR;STROM L;MARCHAND F;NIJS I","SOIL GAS PRODUCTION PROCESSES, MAINLY ANAEROBIC OR AEROBIC SOIL RESPIRATION, DRIVE MAJOR GAS FLUXES ACROSS THE SOIL-ATMOSPHERE INTERFACE. CARBON DIOXIDE (CO2) EFFLUXES, AN EFFLUX WHICH IN MOST ECOSYSTEMS IS A RESULT OF BOTH AUTOTROPHIC AND HETEROTROPHIC RESPIRATION, IN PARTICULAR HAVE RECEIVED INTERNATIONAL ATTENTION. THE IMPORTANCE OF BOTH CO2 AND METHANE (CH4) FLUXES ARE EMPHASISED IN THE ARCTIC BECAUSE OF THE LARGE AMOUNT OF SOIL ORGANIC CARBON STORED IN TERRESTRIAL ECOSYSTEMS AND CHANGES IN UPTAKE AND RELEASE DUE TO CLIMATE CHANGES. THIS CHAPTER FOCUSES ON CONTROLS ON SPATIAL AND TEMPORAL TRENDS IN SUBSURFACE CO2 AND CH4 PRODUCTION AS WELL AS ON TRANSPORT AND RELEASE OF GASES FROM THE SOIL OBSERVED IN THE VALLEY ZACKENBERGDALEN. A DOMINANCE OF NEAR-SURFACE TEMPERATURES CONTROLLING BOTH SPATIAL AND SEASONAL TRENDS IS SHOWN BASED ON DATA OBTAINED USING CLOSED CHAMBER AND EDDY-CORRELATION TECHNIQUES AS WELL AS IN MANIPULATED FIELD PLOTS AND IN CONTROLLED INCUBATION EXPERIMENTS. DESPITE VARIABLE TEMPERATURE SENSITIVITIES REPORTED, MOST DATA CAN BE FAIRLY WELL FITTED TO EXPONENTIAL TEMPERATURE-DEPENDENT EQUATIONS. THE WATER CONTENT (AT WET SITES LINKED TO THE DEPTH TO THE WATER TABLE) IS A SECOND MAJOR FACTOR REGULATING SOIL RESPIRATION PROCESSES, BUT THE EFFECT IS QUITE DIFFERENT IN CONTRASTING VEGETATION TYPES. DRY HEATH SITES ARE SHOWN TO BE PERIODICALLY WATER LIMITED DURING THE GROWING SEASON AND RESPOND THEREFORE WITH HIGH RESPIRATION RATES WHEN WATERED. IN CONTRAST, WATER SATURATED CONDITIONS DURING MOST OF THE GROWING SEASON IN THE FEN AREAS HINDER THE AVAILABILITY OF OXYGEN, RESULTING IN BOTH CO2 AND CH4 PRODUCTION. THUS, WATER TABLE DRAWDOWN RESULTS IN DECREASING CH4 EFFLUXES BUT INCREASING CO2 EFFLUXES. ADDITIONAL CONTROLS ON GAS PRODUCTION ARE SHOWN TO BE RELATED TO THE AVAILABILITY OF SUBSTRATE AND PLANT PRODUCTIVITY. SUBSURFACE GAS PRODUCTION WILL PRODUCE PARTIAL AND TOTAL PRESSURE GRADIENT CAUSING GAS TRANSPORT, WHICH IN WELL-DRAINED SOILS IS MAINLY CONTROLLED BY DIFFUSION, WHEREAS GAS ADVECTION, BUBBLES AND TRANSPORT THROUGH ROOTS AND STEMS MAY BE IMPORTANT IN MORE SATURATED SOILS. BURSTS OF CO2 GAS HAVE BEEN OBSERVED DURING SPRING THAW AND CONFIRMED IN CONTROLLED SOIL THAWING EXPERIMENTS. FIELD OBSERVATIONS AS WELL AS EXPERIMENTAL WORK SUGGEST THAT SUCH BURSTS REPRESENT PARTLY ON-GOING SOIL RESPIRATION AND A PHYSICAL RELEASE OF GAS PRODUCED DURING THE WINTER. THE IMPORTANCE OF WINTER SOIL RESPIRATION IS EMPHASISED BECAUSE OF THE FACT THAT MICROBIAL RESPIRATION IN ZACKENBERG SAMPLES IS NOTED DOWN TO A LEAST -18 DEGREES C. HENCE, THE IMPORTANCE OF WINTER RESPIRATION AND BURST EVENTS IN RELATION TO SEASONAL AND FUTURE CLIMATE TRENDS REQUIRES MORE THAN JUST SUMMER MEASUREMENTS. FOR EXAMPLE, THE AUTUMN PERIOD SEEMS IMPORTANT AS SNOWFALL PRIOR TO LOW AIR TEMPERATURE MAY INSULATE THE SOIL, KEEPING SOIL TEMPERATURES HIGH. THIS WILL EXTEND THE PERIOD OF HIGH SOIL RESPIRATION RATES AND THEREBY INCREASE THE IMPORTANCE OF THE WINTER PERIOD FOR THE ANNUAL CARBON BALANCE. BECAUSE OF THE COMPLEXITY OF FACTORS CONTROLLING SUBSURFACE GAS PRODUCTION, WE CONCLUDE THAT DIFFERENT PARTS OF THE LANDSCAPE WILL RESPOND QUITE DIFFERENTLY TO THE SAME CLIMATE CHANGES AS WELL AS THAT SHORT-TERM EFFECTS ARE LIKELY TO BE DIFFERENT FROM LONG-TERM EFFECTS.","HIGH-ARCTIC SOIL CO2 AND CH4 PRODUCTION CONTROLLED BY TEMPERATURE, WATER, FREEZING AND SNOW","ADVANCES IN ECOLOGICAL RESEARCH, VOL 40: HIGH-ARCTIC ECOSYSTEM DYNAMICS IN A CHANGING CLIMATE","REVIEW",NA,2008,"10.1016/S0065-2504(07)00019-0","ECOLOGY","WOS:000256528000019"
