"","AU","AB","TI","SO","DT","PD","PY","DI","WC","UT"
"LENZ OK, 2005, PALAEONTOGR ABT B","LENZ OK","A DETAILED PALYNOLOGICAL INVESTIGATION OF THE WULFERSDORF SEAMS AND ASSOCIATED SEDIMENTS WITHIN THE UPPER SEAM GROUP OF HELMSTEDT HAS BEEN CARRIED OUT WITH THE AIM OF DEMONSTRATING THE POTENTIAL OF PALYNOLOGICAL ANALYSIS FOR PALEOECOLOGICAL INFORMATION. 182 TAXA OF SPORES, POLLEN AND PLANKTON ARE DESCRIBED IN A SYSTEMATIC CHAPTER AND FIGURED ON 14 PLATES. THE RESULTS OF QUANTITATIVE ANALYSIS AND THE DISTRIBUTION OF PALYNOMORPHS ARE PRESENTED IN 12 HIGH-RESOLUTION POLLEN DIAGRAMS FROM DIFFERENT SECTIONS OF THE LIGNITE BEARING SUCCESSION. IN ORDER TO PROVIDE A MORE OBJECTIVE ECOLOGICAL EVALUATION VARIOUS METHODS OF MULTIVARIATE STATISTICS SUCH AS CLUSTER ANALYSIS AND PRINCIPAL COMPONENT ANALYSIS WERE APPLIED. IN ADDITION, ISOPOLLEN MAPS HAVE BEEN CONSTRUCTED FROM A CARBONACEOUS BAND OCCURRING WITHIN AN ESTUARINE INTERBED AND REPRESENTING A BRIEF TERRESTRIALISATION EVENT. SAMPLING WAS CARRIED OUT ALONG A NARROW TIME PLANE DURING MINING PROGRESS. BASED ON BOTH, STATISTICAL ANALYSES AND ISOPOLLEN MAPS, A DETAILED VEGETATION MODEL OF A MIDDLE EOCENE COASTAL SWAMP HAS BEEN CONSTRUCTED. THE MIDDLE EOCENE COASTAL PLAIN VEGETATION IN THE HELMSTEDT AREA WAS CHARACTERIZED BY A CLEAR ZONATION IN RESPONSE TO THE PROXIMITY OF THE COAST AND EXPOSURE TO SALT-WATER. THUS, VARIATIONS IN COMPOSITION OF PALYNOMORPH ASSEMBLAGES ARE CONTROLLED BY SHIFTS OF ENVIRONMENT AND FACIES RATHER THAN CLIMATIC EFFECTS. A MANGROVE BELT COMPARABLE TO MODERN MANGROVES IS INDICATED BY THE RESTRICTED OCCURRENCE OF POLLEN OF RHIZOPHORA, AVICENNIA AND NYPA AS WELL AS THE FORM TAXON PSILODIPORITES ISZKASZENTGYOERGYI OF UNCERTAIN BOTANICAL AFFINITY. BEHIND THE MANGROVE ZONE, POLLEN OF RESTIONACEAE AND SPARGANIACEAE/TYPHACEAE INDICATE THE PRESENCE OF A MORE OPEN, MARSH-LIKE VEGETATION TOGETHER WITH THE CLOSELY ASSOCIATED PLICAPOLLIS PSEUDOEXCELSUS AND POMPECKJOIDAEPOLLENITES SUBHERCYNICUS, PROBABLY POLLEN OF WOODY PLANTS OF KNOWN RESP. ASSUMED JUGLANDACEOUS AFFINITY. OTHER ELEMENTS, SUCH AS PALMS APPARENTLY GREW IN RESTRICTED STANDS, PERHAPS IN TREE ISLANDS DOTTING THE MORE OPEN MARSH-LIKE VEGETATION, SINCE THEIR POLLEN SHOWS A PATCHY DISTRIBUTION. THE MAIN PEAT FORMING VEGETATION WAS A MIRE FOREST DOMINATED BY FAGACEAE AND ASSOCIATED WITH MYRICACEAE, JUGLANDACEAE, AQUIFOLIACEAE AND NYSSACEAE. THIS OCCURED IN ALTERNATION WITH A CORYLACEAE DOMINATED FOREST INCLUDING CYRILLACEAE AND SAPOTACEAE. ERICACEAE PROBABLY FORMED AN UNDERSTOREY ON NUTRIENT DEFICIENT SOILS.","PALYNOLOGY AND PALAEOECOLOGY OF A COASTAL SWAMP FROM THE MIDDLE EOCENE OF CENTRAL EUROPE - THE WULFERSDORF SEAM GROUP FROM THE OPEN CAST MINE HELMSTEDT, LOWER SAXONY","PALAEONTOGRAPHICA ABTEILUNG B-PALAEOPHYTOLOGIE PALAEOBOTANY-PALAEOPHYTOLOGY","REVIEW","AUG",2005,NA,"PALEONTOLOGY","WOS:000232935800001"
"ROYLES J, 2015, GLOBAL CHANGE BIOL","ROYLES J;GRIFFITHS H","MOSSES ARE THE DOMINANT PLANTS IN POLAR AND BOREAL REGIONS, AREAS WHICH ARE EXPERIENCING RAPID IMPACTS OF REGIONAL WARMING. LONG-TERM MONITORING PROGRAMMES PROVIDE SOME RECORDS OF THE RATE OF RECENT CLIMATE CHANGE, BUT MOSS PEAT BANKS CONTAIN AN UNRIVALLED TEMPORAL RECORD OF PAST CLIMATE CHANGE ON TERRESTRIAL PLANT ANTARCTIC SYSTEMS. WE SUMMARISE THE CURRENT UNDERSTANDING OF CLIMATIC PROXIES AND DETERMINANTS OF MOSS GROWTH FOR CONTRASTING CONTINENTAL AND MARITIME ANTARCTIC REGIONS, AS INFORMED BY 13C AND 18O SIGNALS IN ORGANIC MATERIAL. RATES OF MOSS ACCUMULATION ARE MORE THAN THREE TIMES HIGHER IN THE MARITIME ANTARCTIC THAN CONTINENTAL ANTARCTICA WITH GROWING SEASON LENGTH BEING A CRITICAL DETERMINANT OF GROWTH RATE, AND HIGH CARBON ISOTOPE DISCRIMINATION VALUES REFLECTING OPTIMAL HYDRATION CONDITIONS. CORRELATION PLOTS OF 13C AND 18O VALUES SHOW THAT SPECIES (CHORISODONTIUM ACIPHYLLUM / POLYTRICHUM STRICTUM) AND GROWTH FORM (HUMMOCK / BANK) ARE THE MAJOR DETERMINANTS OF MEASURED ISOTOPE RATIOS. THE INTERPLAY BETWEEN MOSS GROWTH FORM, PHOTOSYNTHETIC PHYSIOLOGY, WATER STATUS AND ISOTOPE COMPOSITION ARE COMPARED WITH DEVELOPMENTS OF SECONDARY PROXIES, SUCH AS CHLOROPHYLL FLUORESCENCE. THESE APPROACHES PROVIDE A FRAMEWORK TO CONSIDER THE POTENTIAL IMPACT OF CLIMATE CHANGE ON TERRESTRIAL ANTARCTIC HABITATS AS WELL AS HAVING IMPLICATIONS FOR FUTURE STUDIES OF TEMPERATE, BOREAL AND ARCTIC PEATLANDS. THERE ARE MANY URGENT ECOLOGICAL AND ENVIRONMENTAL PROBLEMS IN THE ARCTIC RELATED TO MOSSES IN A CHANGING CLIMATE, BUT THE GEOGRAPHICAL RANGES OF SPECIES AND LIFE-FORMS ARE DIFFICULT TO TRACK INDIVIDUALLY. OUR GOAL WAS TO TRANSLATE WHAT WE HAVE LEARNED FROM THE MORE SIMPLE SYSTEMS IN ANTARCTICA, FOR APPLICATION TO ARCTIC HABITATS.","INVITED REVIEW: CLIMATE CHANGE IMPACTS IN POLAR REGIONS: LESSONS FROM ANTARCTIC MOSS BANK ARCHIVES","GLOBAL CHANGE BIOLOGY","REVIEW","MAR",2015,"10.1111/gcb.12774","BIODIVERSITY CONSERVATION; ECOLOGY; ENVIRONMENTAL SCIENCES","WOS:000349896400004"
"YANG G, 2017, ECOSYST HEALTH SUST","YANG G;PENG CH;CHEN H;DONG FQ;WU N;YANG YZ;ZHANG Y;ZHU D;HE YX;SHI SW;ZENG XY;XI TT;MENG QX;ZHU QA","OFTEN REFERRED TO AS THE ""THIRD POLE,""CHINA'S QINGHAI-TIBETAN PLATEAU DEVELOPED LARGE AMOUNTS OF PEATLAND OWING TO ITS UNIQUE ALPINE ENVIRONMENT. AS A RENEWABLE RESOURCE, PEAT HELPS TO REGULATE THE CLIMATE AS WELL AS PERFORMING OTHER IMPORTANT FUNCTIONS. HOWEVER, IN RECENT YEARS, INTENSIFYING CLIMATE CHANGE AND ANTHROPOGENIC DISTURBANCES HAVE RESULTED IN PEATLAND DEGRADATION AND CONSEQUENTLY MADE SUSTAINABLE DEVELOPMENT OF PEATLAND MORE DIFFICULT. THIS REVIEW SUMMARIZES PEATLAND ECOLOGICAL AND ECONOMIC FUNCTIONS, INCLUDING CARBON SEQUESTRATION, BIODIVERSITY CONSERVATION, ENERGY SUPPLIES, AND ECOTOURISM. IT IDENTIFIES CLIMATE CHANGE AND ANTHROPOGENIC DISTURBANCES AS THE TWO KEY FACTORS ATTRIBUTING TO PEATLAND DEGRADATION AND ECOSYSTEM CARBON LOSS. CURRENT PROBLEMS IN ENVIRONMENTAL DEGRADATION AND FUTURE CHALLENGES IN PEATLAND MANAGEMENT UNDER THE EFFECTS OF GLOBAL WARMING ARE ALSO DISCUSSED AND HIGHLIGHTED.","QINGHAI-TIBETAN PLATEAU PEATLAND SUSTAINABLE UTILIZATION UNDER ANTHROPOGENIC DISTURBANCES AND CLIMATE CHANGE","ECOSYSTEM HEALTH AND SUSTAINABILITY","REVIEW","MAR",2017,"10.1002/ehs2.1263","ECOLOGY; ENVIRONMENTAL SCIENCES","WOS:000403646500003"
"SMITH VR, 2008, POLAR REC","SMITH VR","THIS ARTICLE IS A SEQUEL TO A WORD-MODEL DESCRIPTION OF THE ECOSYSTEM OF SUB-ANTARCTIC MARION ISLAND, PUBLISHED IN THIS JOURNAL 30 YEARS AGO (SMITH 1977). IT EXPANDS ON THE QUALITATIVE CONSIDERATIONS OF PATTERNS OF ENERGY FLOW AND NUTRIENT CYCLING PRESENTED IN THAT PAPER, BY PROVIDING QUANTITATIVE INFORMATION FROM SUBSEQUENT RESEARCH AT THE ISLAND. PRIMARY PRODUCTION OF THE ISLAND'S LOWLAND PLANT COMMUNITIES IS HIGH ON AN ANNUAL BASIS, BECAUSE THE VEGETATION HAS A LONG GROWING SEASON DUE TO THE LACK OF SEVERELY COLD WINTERS OR DROUGHT. DAILY PRODUCTIVITY IS ACTUALLY LOW DUE TO LOW RADIATION LEVELS AND A COOL GROWING SEASON. THE VEGETATION IS PARTICULARLY EFFICIENT REGARDING ITS USE OF NUTRIENTS FOR ITS GROWTH, BUT STILL REQUIRES SUBSTANTIAL AMOUNTS OF NUTRIENTS TO SUPPORT THE HIGH ANNUAL PRODUCTION. SEABIRDS AND SEALS IMPORT LARGE QUANTITIES OF NUTRIENTS FROM THE OCEAN WHEN THEY BREED AND MOULT ON THE ISLAND. THEY MARKEDLY ENHANCE SOIL AND PLANT NUTRIENT STATUS IN THE AREAS IN WHICH THEY OCCUR, AND ALSO IN ADJACENT AREAS. HOWEVER, BY FAR THE GREATER PART OF THE ISLAND'S INLAND VEGETATION IS NOT DIRECTLY INFLUENCED BY BIRDS OR SEALS AND MOST OF THE NUTRIENTS REQUIRED FOR PLANT GROWTH ARE PROVIDED BY DECOMPOSITION OF PLANT LITTER AND PEAT. SOIL INVERTEBRATES ARE CRUCIAL FACILITATORS OF DECOMPOSITION PROCESSES, WHICH ARE OTHERWISE RESTRICTED BY LOW SOIL TEMPERATURES AND HIGH SOIL MOISTURE CONTENTS. INTRODUCED HOUSE MICE HAVE INVADED ALMOST ALL PARTS OF THE ISLAND AND PREDATE HEAVILY ON THE INVERTEBRATES, THUS AFFECTING NUTRIENT MINERALISATION. THIS THREATENS NOT ONLY THE FUNCTIONING (LOWERED NUTRIENT AVAILABILITY LEADING TO SLOWER PLANT GROWTH AND THE PRODUCTION OF A LOWER QUALITY, MORE DECOMPOSITION-RECALCITRANT PLANT LITTER), BUT ALSO THE STRUCTURE (AN ALTERED BALANCE BETWEEN PRODUCTION AND DECOMPOSITION LEADS TO A CHANGE IN THE RELATION BETWEEN PEAT FORMATION AND DEGRADATION, WHICH IS AN IMPORTANT DETERMINANT OF VEGETATION SUCCESSION) OF THE ISLAND'S ECOSYSTEM. IT IS SUGGESTED THAT MICE MAY ALSO AFFECT THE ISLAND'S ECOLOGY BY PREDATING ON SEABIRD CHICKS.","ENERGY FLOW AND NUTRIENT CYCLING IN THE MARION ISLAND TERRESTRIAL ECOSYSTEM: 30 YEARS ON","POLAR RECORD","REVIEW","JUL",2008,"10.1017/S0032247407007218","ECOLOGY; ENVIRONMENTAL SCIENCES","WOS:000257222300002"
"COLLINS PEF, 2006, PALAEOGEOGR PALAEOCL","COLLINS PEF;WORSLEY P;KEITH-LUCAS DM;FENWICK IM","MANY LOWLAND RIVERS ACROSS NORTHWEST EUROPE EXHIBIT BROADLY SIMILAR BEHAVIOURAL RESPONSES TO GLACIAL-INTERGLACIAL TRANSITIONS AND LANDSCAPE DEVELOPMENT. DIFFICULTIES EXIST IN ASSESSING THESE, LARGELY BECAUSE THE EVIDENCE FROM MANY RIVERS REMAINS LIMITED AND FRAGMENTARY. HERE WE ADDRESS THIS ISSUE IN THE CONTEXT OF THE RIVER KENNET, A TRIBUTARY OF THE THAMES, SINCE C. 13,000 CAL BP. SOME SIMILARITIES WITH OTHER RIVERS ARE PRESENT, SUGGESTING THAT REGIONAL CLIMATIC SHIFTS ARE IMPORTANT CONTROLS. THE KENNET DIFFERS FROM THE REGIONAL PATTERN IN A NUMBER OF WAYS. THE RATE OF RESPONSE TO SUDDEN CLIMATIC CHANGE, PARTICULARLY AT THE START OF THE HOLOCENE AND ALSO MID-HOLOCENE FOREST CLEARANCE, APPEARS VERY HIGH. THIS MAY REFLECT ABRUPT SHIFTS BETWEEN TWO CATCHMENT SCALE HYDROLOGICAL STATES ARISING FROM CONTEMPORARY CLIMATES, LAND USE CHANGE AND GEOLOGY. STADIAL HYDROLOGY IS DOMINATED BY NIVAL REGIMES, WITH LIMITED WINTER INFILTRATION AND HIGH SPRING AND SUMMER RUNOFF. UNDER AN INTERGLACIAL CLIMATE, INFILTRATION IS MORE SIGNIFICANT. THE PROBABLE ABSENCE OF PERMAFROST IN THE CATCHMENT MEANS THAT A LAG BETWEEN THE TWO STATES DUE TO ITS GRADUAL DECAY IS UNLIKELY. PALAEOECOLOGY, SUPPORTED BY RADIOCARBON DATES, SUGGESTS THAT, AT THE VERY START OF THE HOLOCENE, A DRAMATIC EPISODE OF FINE SEDIMENT DEPOSITION ACROSS MOST OF THE VALLEY FLOOR OCCURRED, LASTING 500-1000 YEARS. A PHASE OF PEAT ACCUMULATION FOLLOWED AS MINERAL SEDIMENT SUPPLY DECLINED. A FURTHER SHIFT LED TO TUFA DEPOSITION, INITIALLY IN SMALL POOLS, THEN ACROSS THE WHOLE FLOODPLAIN AREA, WITH THE RIVER FLOWING THROUGH CHANNELS CUT IN TUFA AND EXPERIENCING REPEATED AVULSION. MAJOR FLOODS, LEAVING LARGE GRAVEL BARS THAT STILL FORM POSITIVE RELIEF FEATURES ON THE FLOODPLAIN, FOLLOWED MID-HOLOCENE FLOODPLAIN STABILITY. PREHISTORIC DEFORESTATION IS LIKELY TO BE THE CAUSE OF THIS FLOODING, INDUCING A MAJOR ENVIRONMENTAL SHIFT WITH SIGNIFICANTLY INCREASED SURFACE RUNOFF. SINCE THE BRONZE AGE, PREDOMINANTLY FINE SEDIMENTS WERE DEPOSITED ALONG THE VALLEY WITH APPARENTLY STABLE CHANNELS AND VERTICAL FLOODPLAIN ACCRETION ASSOCIATED WITH SOIL EROSION AND LESS CATASTROPHIC FLOODING. THE KENNET DEMONSTRATES THAT, WHILE A GENERAL PATTERN OF RIVER BEHAVIOUR OVER TIME, WITHIN A REGION, MAY BE IDENTIFIABLE, INDIVIDUAL RIVERS ARE LIKELY TO DIVERGE FROM THIS. CONSEQUENTLY, IT IS ESSENTIAL TO UNDERSTAND CATCHMENT CONTROLS, PARTICULARLY THE RELATIVE SIGNIFICANCE OF SURFACE AND SUBSURFACE HYDROLOGY. (C) 2005 ELSEVIER B.V. ALL RIGHTS RESERVED.","FLOODPLAIN ENVIRONMENTAL CHANGE DURING THE YOUNGER DRYAS AND HOLOCENE IN NORTHWEST EUROPE: INSIGHTS FROM THE LOWER KENNET VALLEY, SOUTH CENTRAL ENGLAND","PALAEOGEOGRAPHY PALAEOCLIMATOLOGY PALAEOECOLOGY","REVIEW","APR 4",2006,"10.1016/j.palaeo.2005.09.014","GEOGRAPHY, PHYSICAL; GEOSCIENCES, MULTIDISCIPLINARY; PALEONTOLOGY","WOS:000236630700007"
"GRONDAHL L, 2008, ADV ECOL RES","GRONDAHL L;FRIBORG T;CHRISTENSEN TR;EKBERG A;ELBERLING B;ILLERIS L;NORDSTROM C;RENNERMALM A;SIGSGAARD C;SOGAARD H","SUMMERTIME MEASUREMENTS OF CO2 AND CH4 FLUXES WERE CARRIED OUT OVER A RANGE OF HIGH-ARCTIC ECOSYSTEM TYPES IN THE VALLEY ZACKENBERGDALEN SINCE 1996 USING BOTH CHAMBER AND EDDY COVARIANCE METHODOLOGY. THE NET ECOSYSTEM CO2 EXCHANGE AND CH4 FLUX DATA PRESENTED REVEAL A HIGH DEGREE OF INTER-ANNUAL VARIABILITY WITHIN THE DOMINANT VEGETATION TYPES IN THE VALLEY, BUT ALSO SHOW DISTINCT DIFFERENCES BETWEEN THEM. IN PARTICULAR, THE WET AND DRY PARTS OF THE VALLEY SHOW DISTINCT DIFFERENCES. IN GENERAL, THE WET PARTS OF THE VALLEY, THE FENS DOMINATED BY WHITE COTTON GRASS ERIOPHORUM SCHEUCHZERI, SHOW HIGH PRODUCTIVITY, ALSO IN COMPARISON WITH OTHER SITES, WHEREAS CO2 UPTAKE RATES IN THE WHITE ARCTIC BELL HEATHER CASSIOPE TETRAGONA AND MOUNTAIN AVENS DRYAS SPP.-DOMINATED HEATHS ARE MUCH SMALLER. ALSO WITHIN THE DIFFERENT ECOSYSTEM TYPES, A HIGH DEGREE OF SPATIAL VARIABILITY CAN BE DOCUMENTED. THE SPATIAL VARIABILITY BOTH WITHIN AND BETWEEN ECOSYSTEM TYPES IS ESPECIALLY PRONOUNCED FOR THE CH4 FLUX AND CAN, AT LEAST PARTLY, BE RELATED TO DIFFERENCES IN VEGETATION COMPOSITION AND WATER TABLE LEVEL. THE IMPORTANCE OF THE CH4 EMISSION FROM THE VARIOUS ECOSYSTEM TYPES IS EVALUATED BOTH IN RELATION TO CARBON AND GREENHOUSE GAS BUDGETS. IN BOTH WET AND DRIER ECOSYSTEM COMPONENTS, INTER-ANNUAL VARIABILITY SEEMS BEST EXPLAINED THROUGH DIFFERENCES IN THE AMOUNT AND DISTRIBUTION OF SNOW IN SPRING AND THE LENGTH OF THE GROWING SEASON. A LARGE NUMBER OF REPLICATE CHAMBER MEASUREMENTS CARRIED OUT OVER VARIOUS VEGETATION TYPES IN THE VALLEY ARE USED TO PRODUCE A SYNTHESIS OF 10 YEARS OF FLUX DATA AVAILABLE ON GROWING SEASON CARBON DYNAMICS AND CH4 EMISSION PATTERNS IN THE INDIVIDUAL PARTS OF THIS HIGH-ARCTIC ECOSYSTEM AND RELATES THE DIFFERENCES BETWEEN THE ECOSYSTEMS FOUND IN ZACKENBERGDALEN TO COMPARABLE SITES IN THE CIRCUMPOLAR NORTH.","SPATIAL AND INTER-ANNUAL VARIABILITY OF TRACE GAS FLUXES IN A HETEROGENEOUS HIGH-ARCTIC LANDSCAPE","ADVANCES IN ECOLOGICAL RESEARCH, VOL 40: HIGH-ARCTIC ECOSYSTEM DYNAMICS IN A CHANGING CLIMATE","REVIEW",NA,2008,"10.1016/S0065-2504(07)00020-7","ECOLOGY","WOS:000256528000020"
"FREEDMAN B, 2009, ENVIRON REV","FREEDMAN B;STINSON G;LACOUL P","L'AUGMENTATION DES QUANTITES DE CARBONE ORGANIQUE ACCUMULEES DANS LA BIOMASSE DES ECOSYSTEMES TERRESTRES CONSTITUE UN MOYEN EFFICACE POUR REDUIRE LES EMISSIONS ANTHROPOGENES NETTES DE GAZ A EFFETS DE SERRE DANS L'ATMOSPHERE. ON PEUT ATTEINDRE CET OBJECTIF EN CONSERVANT LES RESERVOIRS ECOLOGIQUES DE CARBONE ORGANIQUE EXISTANTS, EN MAINTENANT OU EN AUGMENTANT LE TAUX DE SEQUESTRATION, ET EN RESTAURANT LES RESERVES QUI ONT ETE EPUISEES PAR LES UTILISATIONS PASSEES DES TERRITOIRES. LA PLUPART DES SYSTEMES DE COMPENSATION DES GAZ A EFFET DE SERRE RECONNAISSENT LA VALIDITE DES PROJETS CONDUISANT A DES COMPENSATIONS ECOLOGIQUES ET LEUR PERMETTENT DE VENDRE DES CREDITS DE CARBONE DANS UN MARCHE EMERGENT VISANT CES NOUVEAUX BIENS MARCHANDS. BIEN QUE LES PROJETS ECOLOGIQUES DE COMPENSATION DU CARBONE AIENT ETE CRITIQUES SELON DIFFERENTES PERSPECTIVES, ON PEUT MITIGER DE FACON SATISFAISANTE, LA PLUPART DES SUPPOSES PROBLEMES. EN PLUS DE COMPENSER LES EMISSIONS DE GAZ A EFFETS DE SERRE, LES PROJETS ECOLOGIQUES QUI ACCUMULENT DES CREDITS DE CARBONE PEUVENT PRESENTER DES LIENS ETROITS AVEC LA CONSERVATION DE VALEURS NATURELLES, QUI EN SOI CONSTITUENT UNE ACTION IMPORTANTE QUE DOIT ENTREPRENDRE LA SOCIETE. CEPENDANT, CETTE CONSIDERATION S'APPLIQUE MOINS AUX PROJETS BASES SUR DES ACTIVITES ANTHROPOGENIQUES COMME LES SYSTEMES DE CULTURE SANS LABOUR ET LES PLANTATIONS FORESTIERES, QUI RAPPORTENT RELATIVEMENT PEU DE BENEFICES A LA BIODIVERSITE INDIGENE ET PEUVENT MEME S'ELOIGNER DE L'OBJECTIF, SI ON LES APPLIQUE A DES HABITATS NATURELS RECEMMENT CONVERTIS. DE PLUS, LES REGLES EXISTANTES POUR LES SYSTEMES DE COMPENSATION DU CARBONE EXCLUENT CERTAINS TYPES DE PROJETS ECOLOGIQUES DU MARCHE BOURSIER, MEME S'ILS PERMETTRAIENT D'EVITER DES EMISSIONS OU AUGMENTER LA SEQUESTRATION DE CARBONE ORGANIQUE. A MESURE QUE LES MARCHES EMERGENTS DES COMPENSATIONS EN CARBONE S'ACCROISSENT, IL DEVIENDRA IMPORTANT DE COMPRENDRE LES COBENEFICES ET LES EFFETS SECONDAIRES DES PROJETS DE COMPENSATION DE VALEURS AUTRES QUE LE CARBONE, INCLUANT LA BIODIVERSITE INDIGENE.","CARBON CREDITS AND THE CONSERVATION OF NATURAL AREAS","ENVIRONMENTAL REVIEWS","REVIEW",NA,2009,"10.1139/A08-007","ENVIRONMENTAL SCIENCES","WOS:000273768500001"
"WHITEHOUSE NJ, 2004, HOLOCENE","WHITEHOUSE NJ","RESULTS OF A FOSSIL COLEOPTERA (BEETLE) FAUNA FROM A FEN EDGE SEQUENCE FROM HATFIELD MOORS, HUMBERHEAD LEVELS, ENGLAND, ARE PRESENTED. MIRE ONTOGENY INFERRED FROM THIS LOCATION AND OTHERS ARE DISCUSSED, PARTICULARLY IN THE LIGHT OF PREVIOUS PALYNOLOGICAL AND PLANT MACROFOSSIL INVESTIGATIONS. PEAT INITIATION ACROSS MOST OF THE SITE CENTRES AROUND 3000 CAL. BC, CHARACTERIZED BY A CALLUNA-ERIOPHORUM HEATH WITH AREAS OF PINUS-BETULA WOODLAND. THE ONSET OF PEAT ACCUMULATION ON THE SOUTHERN MARGINS OF THE SITE WAS DELAYED UNTIL 15201390 CAL. BC AND APPEARS TO OVERLAP CLOSELY WITH A RECURRENCE SURFACE AT A POLLEN SITE (HAT 2) DATED TO 16101440 CAL. BC, SUGGESTING THAT INCREASED SURFACE WETNESS MAY HAVE CAUSED MIRE EXPANSION AT THIS TIME. THE FAUNAS ILLUSTRATE THE TRANSITION FROM EUTROPHIC AND MESOTROPHIC FEN TO OMBROTROPHIC RAISED MIRE, ALTHOUGH THE SIGNIFICANCE OF BOTH PINUS- AND CALLUNA-INDICATING SPECIES THROUGH THE SEQUENCE SUGGESTS THAT HEATH HABITATS MAY HAVE CONTINUED TO BE IMPORTANT. ELSEWHERE, THIS EARLIER PHASE OF RICH FEN IS LACKING AND MESOTROPHIC MIRE DEVELOPED IMMEDIATELY ABOVE NUTRIENT-POOR SANDS, WITH OMBROTROPHIC CONDITIONS INDICATED SOON AFTER. CORRESPONDENCE ANALYSIS OF THE FAUNAS PROVIDES VALUABLE INSIGHTS INTO THE IMPORTANCE OF SANDY HEATH HABITATS ON HATFIELD MOORS. THE CONTINUING INFLUENCE OF THE UNDERLYING COVERSANDS SUGGESTS THESE MAY HAVE BEEN INSTRUMENTAL IN MIRE ONTOGENY. THE RESEARCH HIGHLIGHTS THE USEFULNESS OF USING COLEOPTERA TO ASSESS MIRE ONTOGENY, FLUCTUATIONS IN SITE HYDROLOGY AND VEGETATION COVER, PARTICULARLY WHEN USED IN CONJUNCTION WITH OTHER PEATLAND PROXIES. THE SIGNIFICANCE OF A SUITE OF EXTINCT BEETLE SPECIES IS DISCUSSED WITH REFERENCE TO FOREST HISTORY AND CLIMATIC CHANGE.","MIRE ONTOGENY, ENVIRONMENTAL AND CLIMATIC CHANGE INFERRED FROM FOSSIL BEETLE SUCCESSIONS FROM HATFIELD MOORS, EASTERN ENGLAND","HOLOCENE","REVIEW","JAN",2004,"10.1191/0959683604hl691rp","GEOGRAPHY, PHYSICAL; GEOSCIENCES, MULTIDISCIPLINARY","WOS:000187827300008"
"ZHAO JB, 2016, GLOBAL CHANGE BIOL-a","ZHAO JB;PEICHL M;OQUIST M;NILSSON MB","IN HIGH-LATITUDE REGIONS, CARBON DIOXIDE (CO2) EMISSIONS DURING THE WINTER REPRESENT AN IMPORTANT COMPONENT OF THE ANNUAL ECOSYSTEM CARBON BUDGET; HOWEVER, THE MECHANISMS THAT CONTROL THE WINTER CO2 EMISSIONS ARE CURRENTLY NOT WELL UNDERSTOOD. IT HAS BEEN SUGGESTED THAT SUBSTRATE AVAILABILITY FROM SOIL LABILE CARBON POOLS IS A MAIN DRIVER OF WINTER CO2 EMISSIONS. IN ECOSYSTEMS THAT ARE DOMINATED BY ANNUAL HERBACEOUS PLANTS, MUCH OF THE BIOMASS PRODUCED DURING THE SUMMER IS LIKELY TO CONTRIBUTE TO THE SOIL LABILE CARBON POOL THROUGH LITTER FALL AND ROOT SENESCENCE IN THE AUTUMN. THUS, THE SUMMER CARBON UPTAKE IN THE ECOSYSTEM MAY HAVE A SIGNIFICANT INFLUENCE ON THE SUBSEQUENT WINTER CO2 EMISSIONS. TO TEST THIS HYPOTHESIS, WE CONDUCTED A PLOT-SCALE SHADING EXPERIMENT IN A BOREAL PEATLAND TO REDUCE THE GROSS PRIMARY PRODUCTION (GPP) DURING THE GROWING SEASON. AT THE GROWING SEASON PEAK, VASCULAR PLANT BIOMASS IN THE SHADED PLOTS WAS HALF THAT IN THE CONTROL PLOTS. DURING THE SUBSEQUENT WINTER, THE MEAN CO2 EMISSION RATES WERE 21% LOWER IN THE SHADED PLOTS THAN IN THE CONTROL PLOTS. IN ADDITION, LONG-TERM (2001-2012) EDDY COVARIANCE DATA FROM THE SAME SITE SHOWED A STRONG CORRELATION BETWEEN THE GPP (PARTICULARLY THE LATE SUMMER AND AUTUMN GPP) AND THE SUBSEQUENT WINTER NET ECOSYSTEM CO2 EXCHANGE (NEE). IN CONTRAST, ABIOTIC FACTORS DURING THE WINTER COULD NOT EXPLAIN THE INTERANNUAL VARIATION IN THE CUMULATIVE WINTER NEE. OUR STUDY DEMONSTRATES THE PRESENCE OF A CROSS-SEASONAL LINK BETWEEN THE GROWING SEASON BIOTIC PROCESSES AND WINTER CO2 EMISSIONS, WHICH HAS IMPORTANT IMPLICATIONS FOR PREDICTING WINTER CO2 EMISSION DYNAMICS IN RESPONSE TO FUTURE CLIMATE CHANGE.","GROSS PRIMARY PRODUCTION CONTROLS THE SUBSEQUENT WINTER CO2 EXCHANGE IN A BOREAL PEATLAND","GLOBAL CHANGE BIOLOGY","REVIEW","DEC",2016,"10.1111/gcb.13308","BIODIVERSITY CONSERVATION; ECOLOGY; ENVIRONMENTAL SCIENCES","WOS:000387813300017"
"STILWELL JD, 2012, P GEOLOGIST ASSOC","STILWELL JD;CONSOLI CP","THE CHATHAM ISLANDS, SW PACIFIC, PROVIDE A SIGNIFICANT WINDOW INTO THE PALEOZOIC-CENOZOIC GEOLOGY AND PALAEONTOLOGY OF THIS REMOTE PART OF EASTERN ZEALANDIA, AND TODAY, THEY ARE THE ONLY EMERGENT TRACTS OF AN OTHERWISE SUBMERGED CHATHAM RISE EAST OF NEW ZEALAND. AS PART OF EARLY 19TH CENTURY INTENSIVE SURVEYS BY THE NEW ZEALAND COMPANY, GERMAN SCIENTIST JOHANN KARL ERNST DIEFFENBACH (1811-1855) SPENT THE WINTER MONTHS OF MAY-JULY 1840 STUDYING THE REMOTE EASTERN OUTPOST OF THE CHATHAM ISLANDS ARCHIPELAGO AT 43.7 DEGREES S AND 176.7 DEGREES W, RECORDING THE FIRST GEOLOGICAL OBSERVATIONS IN THIS PART OF THE SOUTHWEST PACIFIC AS PART OF THE LAND SURVEYS TO DETERMINE THE SUITABILITY OF NATURAL RESOURCES AND SETTLEMENT. DIEFFENBACH'S DESCRIPTIONS OF THE CHATHAMS SPARKED SOME INTEREST IN ENGLAND, BUT IT WOULD TAKE SOME 130 YEARS BEFORE THE FIRST GEOLOGIC MAP OF THE CHATHAMS WAS PUBLISHED IN 1970 AS A RESULT OF RESEARCH BY THE INSTITUTE OF GEOLOGICAL AND NUCLEAR SCIENCES (NEW ZEALAND). THE CHATHAMS, TODAY THE ONLY EMERGENT PARTS OF THE CHATHAM RISE EXTENDING EASTWARD FROM THE NEW ZEALAND MAINLAND FOR 1000 KM, HOST THE ONLY OUTCROPS OF THE RISE'S GEOLOGY, WITH DEEP ROOTS IN GONDWANA. THE GEOLOGY COMPRISES BASEMENT ROCKS OF PERMO-TRIASSIC METASEDIMENTS AND SCHISTS WHICH CORRELATE TO THE TORLESSE SUPERGROUP OF NEW ZEALAND, HAVING BEEN CONNECTED TO MARIE BYRD LAND, WEST ANTARCTICA. THROUGH PHASES OF COMPLEX UPLIFT AND ACCRETION ALONG THE GONDWANAN LANDMASS, A CONVERGENT MARGIN ENSUED WITH ASSOCIATED BACK-ARC VOLCANISM WITHIN ANTARCTICA FOR AT LEAST THE PERMIAN TO MID-JURASSIC TIME, WHICH SUBSEQUENTLY EVOLVED INTO A PASSIVE MARGIN, GIVING THE CHATHAM RISE ITS DISTINCTIVE FINGER-LIKE SHAPE. DIVERGENT PLATE MOTIONS, RESULTING FROM THE FINAL FRAGMENTATION OF GONDWANA, PULLED THE ZEALANDIA BLOCK AWAY FROM THE WEST ANTARCTIC MARGIN CA. 85-80 MA CONCURRENTLY WITH RIFTING PHASES THAT CREATED LARGE HORSTS AND GRABENS FORMING A BASIN AND RANGE STYLE LANDSCAPE. TECTONISM ALSO FORMED INTRAPLATE VOLCANIC PROVINCES, INCLUDING THE ESTABLISHMENT OF A MASSIVE ALKALINE BASALT STRATOVOLCANO IN THE LATE CRETACEOUS WITH ASSOCIATED ALKALI OLIVINE BASALTS AND TUFFS. FROM CA. 83 MA THE CHATHAMS WERE POSITIONED AT 70 DEGREES S TO ABOUT 54 DEGREES S AT THE K-PG BOUNDARY, AT A RATE OF APPROXIMATELY 0.9 DEGREES/M.Y. CRUSTAL THINNING AND SUBSIDENCE RESULTED IN THE DEPOSITION OF A THICK SEQUENCE OF ASSOCIATED TERRESTRIAL TO PARALIC RIFT-FILL SEDIMENTS IN THE MID-CRETACEOUS, OVERLAIN BY UPPER CRETACEOUS TO PALEOGENE SHALLOW MARINE VOLCANICLASTICS, GREENSANDS AND MINOR INTERSTITIAL LIMESTONES. HOWEVER, THE PRESENCE OF TERRESTRIAL FAUNA AND FLORA OF PALEOCENE AGE PROVIDES EVIDENCE OF AT LEAST SOME EMERGENT TRACTS OF LAND (CHATHAM PENINSULA) ALONG THE RISE UNTIL AT LEAST THE MID- TO LATE PALEOCENE. THE LOWER CENOZOIC SUCCESSIONS ARE CHARACTERISED BY THIN AND DISCONTINUOUS MARINE SANDSTONES, TUFF AND LIMESTONES, REFLECTING REGIONAL SUBSIDENCE OF THE CHATHAM RISE, CONCOMITANT WITH PULSED VOLCANIC ACTIVITY, WHICH PERSISTED INTERMITTENTLY THROUGHOUT THE LATE CENOZOIC. LIMESTONE DEPOSITION AND VOLCANIC SEDIMENTS WANED BEFORE THE END OF THE PLIOCENE, AND ONLY THIN ACCUMULATIONS OF LITTORAL SANDS, PEATS, DUNE SAND, AND MARINE TERRACE GRAVELS, WERE LAIN DOWN AFTER THE ISLANDS' UPLIFT IN THE LATEST PLIOCENE. CURRENT KNOWLEDGE INFERS THAT THE CHATHAM ISLANDS HAVE BEEN EMERGENT ONLY FOR THE LAST THREE TO FOUR MILLION YEARS. VARYING TERRIGENOUS AND CARBONATE SEDIMENTATION, REFLECTING INTENSE PALAEOCLIMATIC CYCLES FROM GLOBAL COOLING DURING THE PLIOCENE TO HOLOCENE, CONTINUE TO THE PRESENT DAY. (C) 2011 THE GELOGISTS' ASSOCIATION. PUBLISHED BY ELSEVIER LTD. ALL RIGHTS RESERVED.","TECTONO-STRATIGRAPHIC HISTORY OF THE CHATHAM ISLANDS, SW PACIFIC-THE EMERGENCE, FLOODING AND REAPPEARANCE OF EASTERN 'ZEALANDIA'","PROCEEDINGS OF THE GEOLOGISTS ASSOCIATION","REVIEW","JAN",2012,"10.1016/j.pgeola.2011.06.003","GEOLOGY; PALEONTOLOGY","WOS:000300262000015"
