"","AU","AB","TI","SO","DT","PD","PY","DI","WC","UT"
"SHOTYK W, 1996, WATER AIR SOIL POLL","SHOTYK W","PEAT CORES WERE TAKEN FROM TWO CONTRASTING SPHAGNUM BOGS IN THE JURA MOUNTAINS OF SWITZERLAND. AT ETANG DE LA GRUYERE (EGR), 6.5 M OF PEAT HAS ACCUMULATED DURING THE PAST 10,000 YEARS. IN THE FIRST 100 CM OF THIS PROFILE THERE ARE SEVERAL DISTINCT PEAKS IN ASH CONTENT, BUT THE VALUES ARE WELL WITHIN THE RANGE FOR TYPICAL OMBROTROPHIC SPHAGNUM BOGS. THERE IS ALSO CONSIDERABLE VARIATION IN THE CONCENTRATIONS OF MAJOR AND TRACE LITHOGENIC METALS (AL, TI, SC, CA, MG, RB, AND SR), BUT MOST OF THIS IS SIMPLY A REFLECTION OF THE NATURAL VARIATIONS IN THE AMOUNT OF MINERAL MATTER IN THE PEATS. THE CA/MG MOLAR RATIOS IN THE PEATS AT EGR ARE COMPARABLE TO OR LOWER THAN THE AVERAGE RAINWATER COMPOSITION IN THIS AREA, SHOWING THAT THIS SECTION OF THE PEAT CORE IS OMBROTROPHIC (I.E. RAINWATER-FED). IN OTHER WORDS, THE INORGANIC CONSTITUENTS IN THE SURFACE PEATS AT EGR WERE SUPPLIED EXCLUSIVELY BY ATMOSPHERIC DEPOSITION. THIS PEAT CORE, THEREFORE, IS SUITABLE FOR STUDYING THE HISTORICAL RECORD OF ATMOSPHERIC METAL DEPOSITION. ARSENIC, CU; PB, SB, AND ZN ARE ALL MORE ABUNDANT IN SURFACE AND NEAR SURFACE PEAT LAYERS COMPARED TO DEEPER PARTS OF THE PROFILE. ENRICHMENT FACTORS (EFS) FOR THE PROFILE WERE CALCULATED CONSERVATIVELY BY NORMALIZING THE METAL/SC RATIOS OF INDIVIDUAL PEAT SAMPLES TO THE AVERAGE OF THE FIVE LOWEST METAL/SC RATIOS IN THIS PART OF THE CORE (69-84 CM); THESE ARE TENTATIVELY ASSUMED TO REPRESENT PRE-INDUSTRIAL BACKGROUND VALUES. THE MAXIMUM EFS ARE APPROXIMATELY 5 TIMES FOR CU, 15 TIMES FOR AS, AND 30 TO 50 TIMES FOR PB, SB, AND ZN. AT LA TOURBIERE DES GENEVEZ (TGE), 1.5 M OF PEAT REPRESENTS 4,800 YEARS OF PEAT FORMATION. AT THIS SITE, THE ASH CONTENTS ARE HIGHER AND INCREASE PROGRESSIVELY WITH DEPTH TO VALUES WHICH ARE CHARACTERISTIC OF MINEROTROPHIC FEN PEATS. THE CONCENTRATION PROFILES OF AL, TI, SC, CA, MG, RB, SR SHOW THE SAME GENERAL TREND. THE CA/MG MOLAR RATIOS OF THESE PEATS ARE GENERALLY TWICE THE RAINWATER AVERAGE, SHOWING THAT THIS BOG IS ESSENTIALLY MINEROTROPHIC (IE GROUNDWATER-FED). THUS, THE INORGANIC CONSTITUENTS IN THESE PEATS WERE PROVIDED BY BOTH ATMOSPHERIC AND HYDROSPHERIC PROCESSES. DESPITE THIS, THE CU, PB, SB, AND ZN CONCENTRATIONS ARE GENERALLY VERY SIMILAR TO THOSE AT EGR, ESPECIALLY IN THE UPPERMOST PART OF THE PROFILE, INDICATING THAT RECENT ATMOSPHERIC INPUTS ALSO DOMINATE THE SUPPLY OF THESE METALS TO THIS BOG. HOWEVER, THE MINIMUM PB AND SB CONCENTRATIONS IN THIS PROFILE ARE APPROXIMATELY FIVE TIMES HIGHER THAN THE CORRESPONDING VALUES AT EGR. THE MINEROTROPHIC PROFILE AT TGE, THEREFORE, COULD NOT BY ITSELF BE USED CO CALCULATE RATES OF ATMOSPHERIC PB AND SB DEPOSITION BECAUSE IT IS IMPOSSIBLE TO DISTINGUISH BETWEEN ATMOSPHERIC AND HYDROSPHERIC METAL INPUTS. AT TGE, AS CONCENTRATIONS INCREASE CONTINUOUSLY WITH DEPTH, REACHING CONCENTRATIONS IN THE DEEPER, OLDER PEATS WHICH ARE MORE THAN 50 TIMES HIGHER THAN THE 'BACKGROUND' AS VALUES AT EGR. AT THIS SITE THE NATURAL SUPPLY OF AS BY MINERAL SOIL WATER COMPLETELY MASKS THE RECENT, ELEVATED INPUTS CONTRIBUTED BY ATMOSPHERIC DEPOSITION. THUS, THE PEAT CORE FROM TGE IS ALSO UNSUITABLE FOR STUDYING ATMOSPHERIC AS DEPOSITION.","NATURAL AND ANTHROPOGENIC ENRICHMENTS OF AS, CU, PB, SB, AND ZN IN OMBROTROPHIC VERSUS MINEROTROPHIC PEAT BOG PROFILES, JURA MOUNTAINS, SWITZERLAND","WATER AIR AND SOIL POLLUTION","REVIEW","AUG",1996,"10.1007/BF00282657","ENVIRONMENTAL SCIENCES; METEOROLOGY & ATMOSPHERIC SCIENCES; WATER RESOURCES","WOS:A1996VB13500002"
"BALDOCCHI D, 2018, AGR FOREST METEOROL","BALDOCCHI D;CHU HS;REICHSTEIN M","AS THE LIFETIME OF REGIONAL FLUX NETWORKS APPROACH TWENTY YEARS, THERE IS A GROWING NUMBER OF PAPERS THAT HAVE PUBLISHED LONG TERM RECORDS (5 YEARS OR MORE) OF NET CARBON FLUXES BETWEEN ECOSYSTEMS AND THE ATMOSPHERE. UNANSWERED QUESTIONS FROM THIS BODY OF WORK ARE: 1) HOW VARIABLE ARE CARBON FLUXES ON A YEAR TO YEAR BASIS?; 2) WHAT ARE THE BIOPHYSICAL FACTORS THAT MAY CAUSE INTERANNUAL VARIABILITY AND/OR TEMPORAL TRENDS IN CARBON FLUXES?; AND 3) HOW DOES THE BIOPHYSICAL CONTROL ON THIS CARBON FLUX VARIABILITY DIFFER BY CLIMATE AND ECOLOGICAL SPACES? TO ADDRESS THESE QUESTIONS, WE SURVEYED PUBLISHED DATA FROM 59 SITES THAT REPORTED ON FIVE OR MORE YEARS OF CONTINUOUS MEASUREMENTS, YIELDING 544 SITE-YEARS OF DATA. WE FOUND THAT THE STANDARD DEVIATION OF THE INTERANNUAL VARIABILITY IN NET ECOSYSTEM CARBON EXCHANGE (162 GC M(-2) Y(-1)) IS LARGE RELATIVE TO ITS POPULATION MEAN (-200 GC M(-2) Y(-1)). BROAD-LEAVED EVERGREEN FORESTS AND CROPS EXPERIENCED THE GREATEST ABSOLUTE VARIABILITY IN INTERANNUAL NET CARBON EXCHANGE (GREATER THAN 300 GC M(-2) Y(-1)) AND BOREAL EVERGREEN FORESTS AND MARITIME WETLANDS WERE AMONG THE LEAST VARIABLE (LESS THAN 40 GC M(-2) Y(-1)). A DISPROPORTIONATE FRACTION OF THE YEARLY VARIABILITY IN NET ECOSYSTEM EXCHANGE WAS ASSOCIATED WITH BIOPHYSICAL FACTORS THAT MODULATED ECOSYSTEM PHOTOSYNTHESIS RATHER THAN ECOSYSTEM RESPIRATION. YET, THERE WAS APPRECIABLE AND STATISTICALLY SIGNIFICANT COVARIANCE BETWEEN ECOSYSTEM PHOTOSYNTHESIS AND RESPIRATION. CONSEQUENTLY, BIOPHYSICAL CONDITIONS THAT CONSPIRED TO INCREASE ECOSYSTEM PHOTOSYNTHESIS TO FROM ONE YEAR TO THE NEXT WERE ASSOCIATED WITH AN INCREASE IN ECOSYSTEM RESPIRATION, AND VICE VERSA; ON AVERAGE, THE YEAR TO YEAR CHANGE IN RESPIRATION WAS 40% AS LARGE AS THE YEAR TO YEAR CHANGE IN PHOTOSYNTHESIS. THE ANALYSIS ALSO IDENTIFIED SETS OF ECOSYSTEMS THAT ARE ON THE VERGE OF SWITCHING FROM BEING CARBON SINKS TO CARBON SOURCES. THESE INCLUDE SITES IN THE ARCTIC TUNDRA, THE EVERGREEN FORESTS IN THE PACIFIC NORTHWEST AND SOME GRASSLANDS, WHERE YEAR TO YEAR CHANGES IN RESPIRATION ARE OUTPACING THOSE IN PHOTOSYNTHESIS. WHILE A SELECT SET OF CLIMATIC AND ECOLOGICAL FACTORS (E.G. LIGHT, RAINFALL, TEMPERATURE, PHENOLOGY) PLAYED DIRECT AND INDIRECT ROLES ON THIS VARIABILITY, THEIR IMPACT DIFFERED CONDITIONALLY, AS WELL AS BY CLIMATE AND ECOLOGICAL SPACES. FOR EXAMPLE, RAINFALL HAD BOTH POSITIVE AND NEGATIVE EFFECTS. DEFICIENT RAINFALL CAUSED A PHYSIOLOGICAL DECLINE IN PHOTOSYNTHESIS IN TEMPERATE AND SEMI-ARID REGIONS. TOO MUCH RAIN, IN THE HUMID TROPICS, LIMITED PHOTOSYNTHESIS BY LIMITING LIGHT. IN PEATLANDS AND TUNDRA, EXCESS PRECIPITATION LIMITED ECOSYSTEM RESPIRATION WHEN IT RAISED THE WATER TABLE TO THE SURFACE. FOR DECIDUOUS FORESTS, WARMER TEMPERATURES LENGTHENED THE GROWING SEASON, INCREASING PHOTOSYNTHESIS, BUT THIS EFFECT ALSO INCREASED SOIL RESPIRATION. FINALLY, STATISTICAL ANALYSIS WAS PERFORMED TO EVALUATE THE DETECTION LIMIT OF TRENDS; WE COMPUTED THE CONFIDENCE INTERVALS OF TRENDS IN MULTI-YEAR CARBON FLUXES THAT NEED TO BE RESOLVED TO CONCLUDE WHETHER THE DIFFERENCES ARE TO BE ATTRIBUTED TO RANDOMNESS OR BIOPHYSICAL FORCINGS. FUTURE STUDIES AND REPORTS ON INTERANNUAL VARIATIONS NEED TO CONSIDER THE ROLE OF THE DURATION OF THE TIME SERIES ON RANDOM ERRORS WHEN QUANTIFYING POTENTIAL TRENDS AND EXTREME EVENTS.","INTER-ANNUAL VARIABILITY OF NET AND GROSS ECOSYSTEM CARBON FLUXES: A REVIEW","AGRICULTURAL AND FOREST METEOROLOGY","REVIEW","FEB 15",2018,"10.1016/j.agrformet.2017.05.015","AGRONOMY; FORESTRY; METEOROLOGY & ATMOSPHERIC SCIENCES","WOS:000424180100043"
"TURETSKY MR, 2004, WETLANDS","TURETSKY MR;MANNING SW;WIEDER RK","DATING RECENT PEAT DEPOSITS (I.E., PAST SIMILAR TO 300 YRS OF PEAT ACCUMULATION) HAS EMERGED AS AN IMPORTANT YET CHALLENGING TASK FOR ESTIMATING RATES OF ORGANIC MATTER ACCUMULATION AND ATMOSPHERIC POLLUTANT DEPOSITION IN PEATLANDS. DUE TO THEIR OMBROTROPHIC NATURE AND THE TENDENCY FOR SPHAGNUM-DERIVED PEAT TO HAVE HIGH CATION EXCHANGE CAPACITY, PEATLANDS ARE IDEAL ARCHIVES OF ATMOSPHERIC POLLUTION. HOWEVER, EFFORTS TO ESTABLISH DEPTH-AGE RELATIONSHIPS IN PEATS ARE COMPLICATED BY THE DIFFICULTY OF DATING DEPOSITS RELIABLY. ASSUMPTIONS UNDERLYING THE TECHNIQUES AVAILABLE FOR DATING PEAT DEPOSITS OFTEN ARE POORLY UNDERSTOOD AND GENERALLY UNTESTED. WE OUTLINE THE APPROACHES USED TO ESTABLISH DEPTH-AGE RELATIONSHIPS IN PEAT CHRONOLOGIES, INCLUDING BRIEF DESCRIPTIONS OF THE THEORY, ASSUMPTIONS, METHODOLOGY, AND LOGISTICS OF EACH TECHNIQUE. WE INCLUDE BOTH CONTINUOUS DATING METHODS (I.E., METHODS BASED ON C-14, PB-210, CONSTANT BULK DENSITY, ACID-INSOLUBLE ASH, MOSS INCREMENT, POLLEN DENSITY) AND CHRONO-STRATIGRAPHIC MARKERS (I.E., FALLOUT ISOTOPES FROM THE CHERNOBYL ACCIDENT AND NUCLEAR WEAPONS TESTING, POLLEN STRATIGRAPHIES, ISOTHERMAL REMANENCE MAGNETISM, CHARCOAL PARTICLES, SPHERICAL CARBONACEOUS PARTICLES, PAHS, PCBS, DDT, TOXAPHENE) THAT CAN BE MEASURED IN PEAT AND CORRELATED TEMPORALLY WITH KNOWN HISTORICAL EVENTS. WE ALSO DESCRIBE THE RELATIVELY NEW RADIOCARBON APPLICATION OF WIGGLE MATCHING AND USE HYPOTHETICAL DATA TO HIGHLIGHT THE POTENTIAL OF THIS DEVELOPING TECHNIQUE FOR DATING RECENT PEAT. UNTIL THE UNCERTAINTY ASSOCIATED WITH EACH OF THESE DATING APPROACHES IS CLARIFIED, WE RECOMMEND EMPLOYING MULTIPLE TECHNIQUES TO ALLOW FOR CORROBORATION BETWEEN DIFFERENT METHODS.","DATING RECENT PEAT DEPOSITS","WETLANDS","REVIEW","JUN",2004,"10.1672/0277-5212(2004)024[0324:DRPD]2.0.CO;2","ECOLOGY; ENVIRONMENTAL SCIENCES","WOS:000222485000008"
"SLADE R, 2014, NAT CLIM CHANGE","SLADE R;BAUEN A;GROSS R","USING BIOMASS TO PROVIDE ENERGY SERVICES IS A STRATEGICALLY IMPORTANT OPTION FOR INCREASING THE GLOBAL UPTAKE OF RENEWABLE ENERGY. YET THE PRACTICALITIES OF ACCELERATING DEPLOYMENT ARE MIRED IN CONTROVERSY OVER THE POTENTIAL RESOURCE CONFLICTS THAT MIGHT OCCUR, PARTICULARLY OVER LAND, WATER AND BIODIVERSITY CONSERVATION. THIS CALLS INTO QUESTION WHETHER POLICIES TO PROMOTE BIOENERGY ARE JUSTIFIED. HERE WE EXAMINE THE ASSUMPTIONS ON WHICH GLOBAL BIOENERGY RESOURCE ESTIMATES ARE PREDICATED. WE FIND THAT THERE IS A DISJUNCT BETWEEN THE EVIDENCE THAT GLOBAL BIOENERGY STUDIES CAN PROVIDE AND POLICYMAKERS' DESIRE FOR ESTIMATES THAT CAN STRAIGHTFORWARDLY GUIDE POLICY TARGETS. WE HIGHLIGHT THE NEED FOR BOTTOM-UP ASSESSMENTS INFORMED BY EMPIRICAL STUDIES, EXPERIMENTATION AND CROSS-DISCIPLINARY LEARNING TO BETTER INFORM THE POLICY DEBATE.","GLOBAL BIOENERGY RESOURCES","NATURE CLIMATE CHANGE","REVIEW","FEB",2014,"10.1038/NCLIMATE2097","ENVIRONMENTAL SCIENCES; ENVIRONMENTAL STUDIES; METEOROLOGY & ATMOSPHERIC SCIENCES","WOS:000333667300012"
"DAI SF, 2018, INT GEOL REV","DAI SF;YAN XY;WARD CR;HOWER JC;ZHAO L;WANG XB;ZHAO LX;REN DY;FINKELMAN RB","CHINA IS, AND IN THE COMING DECADES SHOULD CONTINUE TO BE, THE LARGEST PRODUCER AND USER OF COAL IN THE WORLD. THE HIGH VOLUME OF COAL USAGE IN CHINA HAS FOCUSED ATTENTION NOT ONLY ON THE TOXIC TRACE ELEMENTS THAT MAY BE RELEASED FROM COAL COMBUSTION BUT ALSO ON THE VALUABLE ELEMENTS THAT MAY OCCUR IN THE COAL AND ASSOCIATED ASH. VALUABLE ELEMENTS IN SEVERAL COALS (OR COAL ASHES) AND SOME COAL-BEARING STRATA IN CHINA (E.G. GE, GA, U, RARE EARTH ELEMENTS AND Y, NB, ZR, SE, V, RE, AU, AND AG, AS WELL AS THE BASE METAL AL) OCCUR AT CONCENTRATIONS COMPARABLE TO OR EVEN HIGHER THAN THOSE IN CONVENTIONAL ECONOMIC DEPOSITS. SEVERAL FACTORS ARE RESPONSIBLE FOR THESE ELEVATED CONCENTRATIONS: (1) INJECTION OF EXFILTRATIONAL SOLUTIONS DURING PEAT ACCUMULATION OR AS PART OF LATER EPIGENETIC ACTIVITY; (2) INJECTION OF INFILTRATIONAL EPIGENETIC SOLUTIONS; (3) INTRODUCTION OF SYNGENETIC ALKALI VOLCANIC ASHES INTO THE PEAT-FORMING ENVIRONMENT OR INTO ASSOCIATED NON-COAL-FORMING TERRESTRIAL ENVIRONMENTS; (4) INPUT OF TERRIGENOUS MATERIALS INTO THE COAL-FORMING ENVIRONMENT; (5) LEACHING OF NON-COAL PARTINGS BY GROUNDWATER/HYDROTHERMAL SOLUTIONS; AND (6) MIXED PROCESSES INVOLVING BOTH HYDROTHERMAL SOLUTIONS AND VOLCANIC ASH. THE VALUABLE ELEMENTS IN CHINESE COALS MAY BE ASSOCIATED WITH EITHER THE ORGANIC MATTER OR MINERAL MATTER, OR HAVE A MIXED ORGANIC- AND INORGANIC-AFFINITY. FOR EXAMPLE, THE GE AND U IN COAL-HOSTED ORE DEPOSITS DOMINANTLY OCCUR IN THE ORGANIC MATTER, WITH ONLY TRACES OF U-BEARING MINERALS BEING PRESENT; GALLIUM MAINLY OCCURS IN BOEHMITE AND KAOLINITE, AND TO A LESSER EXTENT, IN THE ORGANIC MATTER. RARE EARTH ELEMENTS AND Y OCCUR AS CARBONATE-MINERALS (E.G. FLORENCITE, PARISITE), PHOSPHATE-MINERALS (E.G. RHABDOPHANE, SILICO-RHABDOPHANE, AND XENOTIME), AND IN PART ARE ASSOCIATED WITH THE ORGANIC MATTER. SOME METALS (E.G. GE, AL, GA) HAVE BEEN SUCCESSFULLY EXTRACTED AT AN INDUSTRIAL SCALE FROM CHINESE COALS, AND OTHERS HAVE SIGNIFICANT POTENTIAL FOR SUCH EXTRACTION. MAJOR CHALLENGES REMAINING FOR COAL SCIENTISTS INCLUDE THE DEVELOPMENT OF ECONOMIC EXTRACTION METHODS FROM COAL ASH, AND THE CONTROL OF TOXIC ELEMENTS RELEASED DURING THE METAL EXTRACTION PROCESS TO PROTECT HUMAN HEALTH AND TO AVOID ENVIRONMENTAL POLLUTION.","VALUABLE ELEMENTS IN CHINESE COALS: A REVIEW","INTERNATIONAL GEOLOGY REVIEW","REVIEW",NA,2018,"10.1080/00206814.2016.1197802","GEOLOGY","WOS:000427859200005"
"AMOS HM, 2015, ENVIRON SCI TECHNOL","AMOS HM;SONKE JE;OBRIST D;ROBINS N;HAGAN N;HOROWITZ HM;MASON RP;WITT M;HEDGECOCK IM;CORBITT ES;SUNDERLAND EM","CENTURIES OF ANTHROPOGENIC RELEASES HAVE RELEASES IN A GLOBAL LEGACY OF MERCURY (HG) CONTAMINATION. HERE WE USE A GLOBAL MODEL TO QUANTIFY THE IMPACT OF UNCERTAINTY IN HG ATMOSPHERIC EMISSIONS AND CYCLING -ON ANTHROPOGENIC ENRICHMENT AND DISCUSS IMPLICATIONS FOR FUTURE HG LEVELS. THE PLAUSIBILITY OF SENSITIVITY SIMULATIONS IS EVALUATED AGAINST MULTIPLE INDEPENDENT LINES OF OBSERVATION, INCLUDING NATURAL ARCHIVES AND DIRECT MEASUREMENTS OF PRESENT-DAY ENVIRONMENTAL HG CONCENTRATIONS. IT HAS BEEN PREVIOUSLY REPORTED THAT PRE-INDUSTRIAVENRICHMENT RECORDED IN SEDIMENT AND PEAT DISAGREE BY MORE THAN A FACTOR OF 10. WE FIND THIS DIFFERENCE IS LARGELY ERRONEOUS AND CAUSED BY COMPARING PEAT AND SEDIMENT AGAINST DIFFERENT REFERENCE TIME PERIODS. AFTER CORRECTING THIS INCONSISTENR-YI, MEDIAN ENRICHMENT IN HG ACCUMULATION SINCE PRE-INDUSTRIAL 1760 TO 1880 IS A FACTOR OF 4.3 FOR PEAT AND 3.0 FOR SEDIMENT. PRE-INDUSTRIAL ACCUMULATION IN PEAT AND SEDIMENT IS A FACTOR OF GREATER THAN THE PRECOLONIAL ERA (3000-BC TO 1550 AD). MODEL SCENARIOS THAT OMIT ATMOSPHERIC EMISSIONS OF HG,FROIN EARLY MINING ARE INCONSISTENT WITH OBSERVATIONAL CONSTRAINTS ON THE PRESENT-DAY ATMOSPHERIC, OCEANIC, AND SOIL HG RESERVOIRS, AS WELL AS THE MAGNITUDE OF ENRICHMENT IN ARCHIVES. FUTURE REDUCTIONS IN ANTHROPOGENIC EMISSIONS WILL INITIATE A DECLINE IN ATMOSPHERIC CONCENTRATIONS WITHIN 1 YEAR, BUT STABILIZATION OF SUBSURFACE AND DEEP OAEARR HG LEVELS REQUIRES AGGRESSIVE CONTROLS. THESE FINDINGS ARE ROBUST TO THE RANGES OF UNCERTAINTY IN PAST EMISSIONS ARID HG CYCLING.","OBSERVATIONAL AND MODELING CONSTRAINTS ON GLOBAL ANTHROPOGENIC ENRICHMENT OF MERCURY","ENVIRONMENTAL SCIENCE & TECHNOLOGY","REVIEW","APR 7",2015,"10.1021/es5058665","ENGINEERING, ENVIRONMENTAL; ENVIRONMENTAL SCIENCES","WOS:000352659000006"
"DAI SF, 2016, GONDWANA RES","DAI SF;CHEKRYZHOV IY;SEREDIN VV;NECHAEV VP;GRAHAM IT;HOWER JC;WARD CR;REN DY;WANG XB","METALLIFEROUS COAL DEPOSITS, MAINLY HOSTING ZR(HF)-NB(TA)-REE AND U(MO,SE)-REE ORES, IN EAST ASIA (PRIMORYE OF RUSSIA AND SOUTH CHINA) PRIMARILY RESULT FROM THE EVOLUTION OF PLUMES ASCENDING FROM DEEP MANTLE AND/OR ASTHENOSPHERIC FLOWS, BOTH OF WHICH INCORPORATE SOME REWORKING OF THE CONTINENTAL CRUST. THIS MANTLE-CRUST INTERACTION NOT ONLY LED TO COAL-BASIN FORMATION BUT ALSO PLAYED A SIGNIFICANT ROLE IN EXTENSIVE VOLCANISM AND ORE-GENERATING HYDROTHERMAL ACTIVITY. THREE MINERALIZATION STYLES ARE IDENTIFIED IN THESE DEPOSITS: TUFFACEOUS, HYDROTHERMAL-FLUID, AND MIXED TUFFACEOUS-HYDROTHERMAL TYPES. THE TUFFACEOUS ZR(HF)-NB(TA)-REE DEPOSITS HAVE SOURCE MAGMAS WITH AN ALKALI BASALT COMPOSITION, ALTHOUGH FELSIC, MAFIC, AND INTERMEDIATE TYPES OF TUFFACEOUS HORIZONS HAVE BEEN IDENTIFIED IN THE STUDY AREA. THE MINERALIZATION OCCURRED NOT ONLY IN THE COAL BUT ALSO IN THE HOST ROCKS, AND NOT ONLY DURING PEAT ACCUMULATION BUT ALSO DURING THE LATER STAGES OF COAL DEVELOPMENT (INCLUDING COALIFICATION AND LATE EPIGENETIC PROCESSES). RARE METALS IN THE METALLIFEROUS COAL DEPOSITS ARE GENERALLY EITHER ASSOCIATED WITH CLAY AND ORGANIC MATTER OR OCCUR AS SECONDARY MINERALS DERIVED FROM DECOMPOSITION OF THE PRIMARY MAGMATIC RARE-METAL BEARING MINERALS (E.G. NB-BEARING RUTILE) UNDER THE INFLUENCE OF ORGANIC ACIDS AND HYDROTHERMAL FLUIDS. (C) 2015 INTERNATIONAL ASSOCIATION FOR GONDWANA RESEARCH. PUBLISHED BY ELSEVIER B.V. ALL RIGHTS RESERVED.","METALLIFEROUS COAL DEPOSITS IN EAST ASIA (PRIMORYE OF RUSSIA AND SOUTH CHINA): A REVIEW OF GEODYNAMIC CONTROLS AND STYLES OF MINERALIZATION","GONDWANA RESEARCH","REVIEW","JAN",2016,"10.1016/j.gr.2015.07.001","GEOSCIENCES, MULTIDISCIPLINARY","WOS:000367485100003"
"RAMCHUNDER SJ, 2009, PROG PHYS GEOG","RAMCHUNDER SJ;BROWN LE;HOLDEN J","PEATLANDS ARE IMPORTANT ECOSYSTEMS FOR CARBON (C) STORAGE, PROVISION OF WATER RESOURCES AND BIODIVERSITY. UK BLANKET PEATS REPRESENT 10-15% OF THOSE FOUND WORLDWIDE. WHILE MANY PEATLANDS CONTINUE TO BE MANAGED THROUGH ARTIFICIAL DRAINAGE AND VEGETATION BURNING, IT HAS LONG BEEN RECOGNIZED THAT LOCAL HABITATS AND ECOLOGICAL DIVERSITY ARE STRONGLY INFLUENCED BY THESE PRACTICES. THIS PAPER REVIEWS THE HYDROLOGICAL, PHYSICOCHEMICAL AND ECOLOGICAL EFFECTS OF THREE WIDESPREAD U K PEATLAND MANAGEMENT PRACTICES, NAMELY ARTIFICIAL DRAINAGE, DRAIN-BLOCKING AND ROTATIONAL HEATHER BURNING. DRAINAGE AND BURNING OF PEAT OFTEN LEAD TO ALTERED RUNOFF REGIMES, OXIDATION OF ORGANIC MATTER, CHANGES TO C, NITROGEN (N) AND PHOSPHORUS (P) CYCLING, AND INCREASED METAL AND SUSPENDED SEDIMENT CONCENTRATIONS IN STREAMS RELATIVE TO INTACT PEATLANDS. ALTHOUGH ARTIFICIAL DRAINAGE IS NOW RARELY IMPLEMENTED ON UK UPLAND PEATS, A GREAT NUMBER OF HISTORICAL DRAINS REMAIN, THUS DRAIN-BLOCKING IS INCREASINGLY BEING APPLIED TO RESTORE MANY PEATLANDS. IN CONTRAST, RECENT INCREASES IN THE INTENSITY AND EXTENT OF ROTATIONAL HEATHER BURNING MAY RESULT IN FURTHER CHANGES TO PEATLAND ECOSYSTEMS. RELATIVELY LITTLE IS KNOWN ABOUT THE ENVIRONMENTAL EFFECTS OF ROTATIONAL HEATHER BURNING COMPARED WITH DRAINAGE AND DRAIN-BLOCKING MANAGEMENT, AND FOR ALL THREE OF THESE MANAGEMENT TECHNIQUES THERE IS SCARCE INFORMATION ON RIVER ECOSYSTEM RESPONSE. WE HYPOTHESIZE SOME LIKELY EFFECTS OF BASIN-SCALE DRAINAGE, DRAIN-BLOCKING AND HEATHER BURNING ON STREAM ECOSYSTEMS AND ILLUSTRATE THESE WITH A SCHEMATIC MODEL. SUCH A HOLISTIC CONSIDERATION OF PEATLAND RIVER BASINS IS PARTICULARLY TIMELY WITH RESPECT TO THE IMPLEMENTATION OF THE EU WATER FRAMEWORK DIRECTIVE.","ENVIRONMENTAL EFFECTS OF DRAINAGE, DRAIN-BLOCKING AND PRESCRIBED VEGETATION BURNING IN UK UPLAND PEATLANDS","PROGRESS IN PHYSICAL GEOGRAPHY-EARTH AND ENVIRONMENT","REVIEW","FEB",2009,"10.1177/0309133309105245","GEOGRAPHY, PHYSICAL; GEOSCIENCES, MULTIDISCIPLINARY","WOS:000267087900004"
"DAI SF, 2017, EARTH-SCI REV","DAI SF;WARD CR;GRAHAM IT;FRENCH D;HOWER JC;ZHAO L;WANG XB","VOLCANIC ASHES IN COAL AND COAL-BEARING SEQUENCES TYPICALLY OCCUR AS PERSISTENT BANDS WITHIN COAL SEAMS (GENERALLY AS TONSTEINS, BUT IN A FEW CASES AS BENTONITES, K-BENTONITES, OR AS CLAY-FREE PARTINGS), AS AN INTIMATE MIXTURE WITH ORGANIC MATTER, AS HOST ROCKS (SUCH AS ROOF AND FLOOR STRATA), OR AS THICK LAYERS IN COAL-BEARING STRATA THAT ARE STRATIGRAPHICALLY SEPARATED FROM COAL SEAMS, INCLUDING THOSE OF THICK, LATERALLY PERSISTENT TUFFS, AND IN THE BROADER SENSE FRAGMENTAL CLAY ROCKS AND FLINT CLAYS. ALTERED VOLCANIC ASHES HAVE BEEN FOUND IN NUMEROUS COALS WITH RANK RANGING FROM LIGNITE THROUGH VARIOUS BITUMINOUS COALS TO ANTHRACITE, AS WELL AS IN ALL THE CONTINENTS WHERE COAL BEDS ARE PRESENT. THE MAIN PRIMARY MINERALS IN VOLCANIC ASH THAT SURVIVE POST-DEPOSITIONAL ALTERATION INCLUDE HIGH-TEMPERATURE QUARTZ, PLAGIOCLASE, SANIDINE, ZIRCON, APATITE, MONAZITE, MICAS, RUTILE, AND ANATASE. ALTERATION OF VOLCANIC GLASS AND LESS STABLE PRIMARY MINERALS MAY RESULT IN THE FORMATION OF KAOLINITE, SMECTITE, ILLITE, MIXED-LAYER I/S AND, IN SOME CASES, CHLORITE AND ZEOLITES. IN ADDITION TO MINERALOGICAL AND PETROGRAPHIC CHARACTERISTICS, IDENTIFICATION OF THE PARENT MAGMA TYPE IS COMMONLY BASED ON RELATIVELY IMMOBILE ELEMENTS RATHER THAN THE TOTAL ALKALI-SILICA CONTENTS, WHICH ARE OFTEN AFFECTED BY POST-DEPOSITIONAL ALTERATION. FOUR TYPES OF VOLCANIC ASHES HAVE BEEN IDENTIFIED IN COAL AND COAL-BEARING SEQUENCES, NAMELY FELSIC, MAFIC, INTERMEDIATE, AND ALKALI. ALTERED MAFIC VOLCANIC ASHES ARE CHARACTERISTICALLY ENRICHED IN SC, V, CR, CO, AND NI; HAVE POSITIVE EU ANOMALIES; AND ARE OF A MEDIUM-REE ENRICHMENT TYPE. ALTERED ALKALI VOLCANIC ASHES ARE UNIQUE IN THEIR SIGNIFICANT HIGH CONCENTRATIONS OF RARE METALS SUCH AS NB, TA, ZR, HF, REE, AND GA, AND ARE CHARACTERIZED BY DISTINCT NEGATIVE EU ANOMALIES. COMPARED WITH ALTERED ALKALI VOLCANIC ASHES, FELSIC TONSTEINS HAVE RELATIVELY LOWER REE CONCENTRATIONS AND LESS PRONOUNCED NEGATIVE EU ANOMALIES, BUT A GREATER FRACTIONATION BETWEEN LIGHT AND HEAVY REES. THE COMPOSITIONAL VARIATION OF DIFFERENT TYPES OF ALTERED VOLCANIC ASHES IS ATTRIBUTED TO THE TECTONIC FRAMEWORK AND GEODYNAMIC CONTROLS. VOLCANIC ASHES IN COAL MAY SERVE AS CHRONOSTRATIGRAPHIC MARKERS TO IDENTIFY AND CORRELATE COAL SEAMS, AND CAN ALSO BE USED FOR RADIOMETRIC AGE DETERMINATION. THE ASHES MAY HAVE PROVIDED TERRIGENOUS MATERIALS THAT SERVED AS SUBSTRATES FOR PEAT DEVELOPMENT; AND MAY HAVE TERMINATED PEAT ACCUMULATION IF VOLCANIC ASH IN LARGE QUANTITIES FELL INTO THE PEAT SWAMP; THEY CAN ALSO BE USED TO INDICATE THE GEODYNAMIC PROCESSES OF COAL FORMATION; AND PERHAPS EXPLAIN MASS EXTINCTION EVENTS. ADMIXED VOLCANIC ASH MAY LOWER THE QUALITY OF THE COAL IF NOT REMOVED IN THE PREPARATION PLANT. FROM A PRACTICAL VIEWPOINT, ALKALI VOLCANIC ASHES MAY BE SIGNIFICANTLY ENRICHED IN RARE EARTH ELEMENTS, Y, NB, TA, ZR, HF, AND GA, WHICH HAVE POTENTIAL ECONOMIC SIGNIFICANCE. THIS PAPER REVIEWS THE DISTRIBUTION, GEOCHEMICAL AND MINERALOGICAL COMPOSITIONS, AND THE SIGNIFICANCE AND APPLICATIONS OF VOLCANIC ASHES IN COAL AND COAL-BEARING SEQUENCES.","ALTERED VOLCANIC ASHES IN COAL AND COAL-BEARING SEQUENCES: A REVIEW OF THEIR NATURE AND SIGNIFICANCE","EARTH-SCIENCE REVIEWS","REVIEW","DEC",2017,"10.1016/j.earscirev.2017.10.005","GEOSCIENCES, MULTIDISCIPLINARY","WOS:000418983200003"
"MANN DH, 2002, QUATERNARY SCI REV","MANN DH;PETEET DM;REANIER RE;KUNZ ML","MANY OF THE PHYSICAL AND BIOLOGICAL PROCESSES THAT CHARACTERIZE ARCTIC ECOSYSTEMS ARE UNIQUE TO HIGH LATITUDES, AND THEIR SENSITIVITIES TO CLIMATE CHANGE ARE POORLY UNDERSTOOD. STRATIGRAPHIC RECORDS OF LAND-SURFACE PROCESSES AND VEGETATION CHANGE IN THE ARCTIC FOOTHILLS OF NORTHERN ALASKA REVEAL HOW TUNDRA LANDSCAPES RESPONDED TO CLIMATIC CHANGES BETWEEN 13,000 AND 8000 C-14 YR BP. PEAT DEPOSITION BEGAN AND SHRUB VEGETATION BECAME WIDESPREAD CA. 12,500 C-14 YR BP, PROBABLY IN RESPONSE TO THE ADVENT OF WARMER AND WETTER CLIMATE. INCREASED SLOPE EROSION CAUSED RAPID ALLUVIATION IN VALLEYS, AND POPULUS TREES SPREAD NORTHWARD ALONG BRAIDED FLOODPLAINS BEFORE 11,000 C-14 YR BP. LAKE LEVELS FELL AND STREAMS INCISED THEIR FLOODPLAINS DURING THE YOUNGER DRYAS (YD) (11,000-10,000 C-14 YR BP). A HIATUS IN RECORDS OF POPULUS SUGGEST THAT ITS GEOGRAPHIC RANGE CONTRACTED, AND POLLEN RECORDS OF OTHER SPECIES SUGGEST A COOLER AND DRIER CLIMATE DURING THIS INTERVAL. BASAL PEATS DATING TO THE YD ARE RARE, SUGGESTING THAT RATES OF PALUDIFICATION SLOWED. IMMEDIATELY AFTER 10,000 C-14 YR BP, LAKE LEVELS ROSE, STREAMS AGGRADED RAPIDLY AGAIN, INTENSE SOLIFLUCTION OCCURRED, AND POPULUS RE-INVADED THE AREA. MOIST ACIDIC TUNDRA VEGETATION WAS WIDESPREAD BY 8500 C-14 YR BP ALONG WITH WET, ORGANIC-RICH SOILS. MOST OF THESE LANDSCAPE-SCALE EFFECTS OF CLIMATIC CHANGE INVOLVED CHANGES IN MOISTURE. ALTHOUGH LOW TEMPERATURE IS THE MOST CONSPICUOUS FEATURE OF ARCTIC CLIMATE, SHIFTS IN EFFECTIVE MOISTURE MAY BE THE PROXIMATE CAUSE FOR MANY OF THE IMPACTS THAT CLIMATE CHANGE HAS IN ARCTIC REGIONS. (C) 2002 ELSEVIER SCIENCE LTD. ALL RIGHTS RESERVED.","RESPONSES OF AN ARCTIC LANDSCAPE TO LATEGLACIAL AND EARLY HOLOCENE CLIMATIC CHANGES: THE IMPORTANCE OF MOISTURE","QUATERNARY SCIENCE REVIEWS","REVIEW","APR",2002,"10.1016/S0277-3791(01)00116-0","GEOGRAPHY, PHYSICAL; GEOSCIENCES, MULTIDISCIPLINARY","WOS:000175566100012"
