"","AU","AB","TI","SO","DT","PD","PY","DI","WC","UT"
"EHLERINGER JR, 1997, OECOLOGIA","EHLERINGER JR;CERLING TE;HELLIKER BR","THE OBJECTIVES OF THIS SYNTHESIS ARE (1) TO REVIEW THE FACTORS THAT INFLUENCE THE ECOLOGICAL, GEOGRAPHICAL, AND PALAEOECOLOGICAL DISTRIBUTIONS OF PLANTS POSSESSING C-4 PHOTOSYNTHESIS AND (2) TO PROPOSE A HYPOTHESIS/MODEL TO EXPLAIN BOTH THE DISTRIBUTION OF C-4 PLANTS WITH RESPECT TO TEMPERATURE AND CO2 AND WHY C-4 PHOTOSYNTHESIS IS RELATIVELY UNCOMMON IN DICOTYLEDONOUS PLANTS (HEREAFTER DICOTS), ESPECIALLY IN COMPARISON WITH ITS WIDESPREAD DISTRIBUTION IN MONOCOTYLEDONOUS SPECIES (HEREAFTER MONOCOTS). OUR GOAL IS TO STIMULATE DISCUSSION OF THE FACTORS CONTROLLING DISTRIBUTIONS OF C-4 PLANTS TODAY, HISTORICALLY, AND UNDER FUTURE ELEVATED CO2 ENVIRONMENTS. UNDERSTANDING THE DISTRIBUTIONS OF C-3/C-4 PLANTS IMPACTS NOT ONLY PRIMARY PRODUCTIVITY, BUT ALSO THE DISTRIBUTION, EVOLUTION, AND MIGRATION OF BOTH INVERTEBRATES AND VERTEBRATES THAT GRAZE ON THESE PLANTS. SIXTEEN SEPARATE STUDIES ALL INDICATE THAT THE CURRENT DISTRIBUTIONS OF C-4 MONOCOTS ARE TIGHTLY CORRELATED WITH TEMPERATURE: ELEVATED TEMPERATURES DURING THE GROWING SEASON FAVOR C-4 MONOCOTS. IN CONTRAST, THE SEVEN STUDIES ON C-4 DICOT DISTRIBUTIONS SUGGEST THAT A DIFFERENT ENVIRONMENTAL PARAMETER, SUCH AS ARIDITY (COMBINATION OF TEMPERATURE AND EVAPORATIVE POTENTIAL), MORE CLOSELY DESCRIBES THEIR DISTRIBUTIONS. DIFFERENCES IN THE TEMPERATURE DEPENDENCE OF THE QUANTUM YIELD FOR CO2 UPTAKE (LIGHT-USE EFFICIENCY) OF C-3 AND C-4 SPECIES RELATE WELL TO OBSERVED PLANT DISTRIBUTIONS AND LIGHT-USE EFFICIENCY IS THE ONLY MECHANISM THAT HAS BEEN PROPOSED TO EXPLAIN DISTRIBUTIONAL DIFFERENCES IN C-3/C-4 MONOCOTS. MODELING OF C-3 AND C-4 LIGHT-USE EFFICIENCIES UNDER DIFFERENT COMBINATIONS OF ATMOSPHERIC CO2 AND TEMPERATURE PREDICTS THAT C-4-DOMINATED ECOSYSTEMS SHOULD NOT HAVE EXPANDED UNTIL ATMOSPHERIC CO2 CONCENTRATIONS REACHED THE LOWER LEVELS THAT ARE THOUGHT TO HAVE EXISTED BEGINNING NEAR THE END OF THE MIOCENE. AT THAT TIME, PALAEOCARBONATE AND FOSSIL DATA INDICATE A SIMULTANEOUS, GLOBAL EXPANSION OF C-4-DOMINATED GRASSLANDS. THE C-4 MONOCOTS GENERALLY HAVE A HIGHER QUANTUM YIELD THAN C-4 DICOTS AND IT IS PROPOSED THAT LEAF VENATION PATTERNS PLAY A ROLE IN INCREASING THE LIGHT-USE EFFICIENCY OF MOST C-4 MONOCOTS. THE REDUCED QUANTUM YIELD OF MOST C-4 DICOTS IS CONSISTENT WITH THEIR RARITY, AND IT IS SUGGESTED THAT C-4 DICOTS MAY NOT HAVE BEEN SELECTED UNTIL CO2 CONCENTRATIONS REACHED THEIR LOWEST LEVELS DURING GLACIAL MAXIMA IN THE QUATERNARY. GIVEN THE INTRINSIC LIGHT-USE EFFICIENCY ADVANTAGE OF C-4 MONOCOTS, C-4 DICOTS MAY HAVE BEEN LIMITED IN THEIR DISTRIBUTIONS TO THE WARMEST ECOSYSTEMS, SALINE ECOSYSTEMS, AND/OR TO HIGHLY DISTURBED ECOSYSTEMS. ALL C-4 PLANTS HAVE A SIGNIFICANT ADVANTAGE OVER C-3 PLANTS UNDER LOW ATMOSPHERIC CO2 CONDITIONS AND ARE PREDICTED TO HAVE EXPANDED SIGNIFICANTLY ON A GLOBAL SCALE DURING FULL-GLACIAL PERIODS, ESPECIALLY IN TROPICAL REGIONS. BOG AND LAKE SEDIMENT CORES AS WELL AS PEDOGENIC CARBONATES SUPPORT THE HYPOTHESIS THAT C-4 ECOSYSTEMS WERE MORE EXTENSIVE DURING THE LAST GLACIAL MAXIMUM AND THEN DECREASED IN ABUNDANCE FOLLOWING DEGLACIATION AS ATMOSPHERIC CO2 LEVELS INCREASED.","C-4 PHOTOSYNTHESIS, ATMOSPHERIC CO2 AND CLIMATE","OECOLOGIA","REVIEW","NOV",1997,"10.1007/s004420050311","ECOLOGY","WOS:A1997YF42100001"
"ALLEN JRL, 2000, QUATERNARY SCI REV","ALLEN JRL","SALT MARSHES, MOST NOW EMBANKED, TOGETHER WITH GENETICALLY RELATED WETLANDS AND HIGH INTERTIDAL FLATS, MAKE A MAJOR ENVIRONMENTAL CONTRIBUTION TO THE LOWLAND COASTS OF NORTHWEST EUROPE. THEY OCCUR IN MANY DIFFERENT CONTEXTS, BUT CHIEFLY ON OPEN AND BARRIER COASTS AND IN ESTUARIES AND EMBAYMENTS, AND RANGE GREATLY IN SCALE, FROM A MODEST TOTAL THAT MEASURE HUNDREDS OF SQUARE KILOMETRES IN INDIVIDUAL EXTENT, TO AN ENORMOUS NUMBER EACH OF AN AREA NO GREATER THAN TENS TO A FEW HUNDRED HECTARES. THESE MARSHES AND ASSOCIATED ENVIRONMENTS ARE UNDER COMPLEX NATURAL CONTROLS AND EXPERIENCED FROM THE MID-HOLOCENE ONWARD HUMAN EXPLOITATION AND, INCREASINGLY, INTERFERENCE. THE MAIN EXTERNAL CONTROLS ARE THE SEA-LEVEL, TIDAL AND SEDIMENT-SUPPLY REGIMES. INTRINSIC INFUENCES ARE PROVIDED BY THE HALOPHYTIC VEGETATION AND SEDIMENT AUTOCOMPACTION. UPWARD SEA-LEVEL MOVEMENTS AND AUTOCOMPACTION COMBINE TO PROVIDE ACCOMODATION SPACE WITHIN WHICH MARSHES BUILD UPWARD. FIELD DATA AND SIMULATION MODELLING SHOW THAT YOUTHFUL MINERALOGENIC MARSHES GROW UP RAPIDLY AND CAN MATURE WITHIN A FEW HUNDRED YEARS OF INCEPTION. THEY CONSIST OF A VEGETATED PLATFORM DISSECTED TYPICALLY BY EXTENSIVE NETWORKS OF BLIND-ENDED, BRANCHING TIDAL CREEKS AND GULLIES. THE HOW-RESISTANT SURFACE VEGETATION, SHAPING THE COMBINED WAVE-TIDE BOUNDARY LAYER ON THE PLATFORMS, BOTH TRAPS AND BINDS TIDALLY INTRODUCED MINERAL SEDIMENT, BUT ALSO CONTRIBUTES AN ORGANIC COMPONENT OF INDIGENOUS ORIGIN TO THE DEPOSIT. WHEN SEA-LEVEL BECOMES STABLE OR FALLS, HOWEVER, IN RESPONSE TO CENTURY-MILLENNIAL SCALE FLUCTUATIONS, THE ORGANIC SEDIMENT COMPONENT BECOMES DOMINANT AND MINERALOGENIC MARSHES ARE TRANSFORMED INTO ORGANOGENIC ONES. ORGANOGENIC MARSHES NORMALLY DISPLAY A CONSIDERABLE RANGE OF SUB-ENVIRONMENTS WHICH CREATE MUCH SPATIAL VARIATION IN THE PEAT FACIES WHICH ACCUMULATE. AT AN ADVANCED STAGE, DOMED RAISED BOGS, RISING SIGNIFICANTLY ABOVE THE GENERAL LANDSCAPE, MAY APPEAR ON THE MARSHES. BECAUSE PEAT IS SUCH A POROUS AND PERMEABLE SEDIMENT, AND THERE IS LITTLE OR NO TIDAL INUNDATION, ORGANOGENIC MARSHES IN NORTHWEST EUROPE TYPICALLY LACK SURFACE CHANNELS FOR INTERNAL DRAINAGE. THE STRATIGRAPHIC SEQUENCES ACCUMULATED DURING THE HOLOCENE BENEATH COASTAL MARSHES AND HIGH TIDAL FLATS TYPICALLY PRESENT AN ALTERNATION ON A VERTICAL SCALE OF DECIMETRES TO METRES OF SILTS (MINERALOGENIC MARSHES, HIGH INTERTIDAL MUDFLATS) AND PEATS (ORGANOGENIC HIGHEST INTERTIDAL-SUPRATIDAL MARSHES). COASTAL BARRIERS AND SOME CHANNELS ARE REPRESENTED BY LOCAL ACCUMULATIONS OF SAND AND/OR GRAVEL. THE SILTS AND PEATS FORM COUPLETS WHICH ARE GENERALLY CONSIDERED TO BE RELATED TO FLUCTUATIONS OF SEA-LEVEL ABOUT THE GENERAL UPWARD TREND. FIELD INVESTIGATIONS AND MODELLING SHOW THAT, IN AREAS WHERE MARSHES ARE MATURE, THE UPWARD CHANGE FROM AN ORGANOGENIC TO A SEQUENCE OF MINERALOGENIC MARSHES (TRANSGRESSIVE OVERLAPS) IS ACCOMPANIED BY THE INITIATION AND INVASIVE DEVELOPMENT OF A BRANCHING NETWORK OF TIDAL CREEKS. THESE DECAY AND INFILL DURING THE REVERSAL OF THE ENVIRONMENTAL SEQUENCE AND THE APPROACH, EXPRESSED AS A SERIES OF REPRESSIVE OVERLAPS, OF THE NEXT SET OF PEAT-FORMING CONDITIONS. THE OPERATION OF THE CONTINUOUS, PROGRESSIVE, IRREVERSIBLE AND ASYMPTOTIC PROCESS OF SEDIMENT AUTOCOMPACTION EXERTS A MAJOR, SECONDARY CONTROL ON DEPOSITIONAL REGIMES AND MARSH BEHAVIOUR. A VARIETY OF LOCAL RESPONSES ARE CONSEQUENTLY POSSIBLE IN AN EXTENSIVE MARSH, EVEN THOUGH THE MARSH MAY BE EVERYWHERE IN DYNAMIC EQUILIBRIUM WITH ENVIRONMENTAL FACTORS. AUTOCOMPACTION ALSO STRONGLY SHAPES THE CHARACTER OF HOLOCENE COASTAL SEQUENCES AS NOW PERCEIVED, INTRODUCING SIGNIFICANT STRATIGRAPHIC DISTORTIONS AND DISPLACEMENTS WHICH, FOR THE TIME BEING, LIMIT THE ACCURACY OF SEA-LEVEL CURVES AND RATES OF SEA-LEVER CHANGE BASED ON DATED INTERCALATED PEATS. PREHISTORIC HUMANS BENEFITTED FROM THE RESOURCES OF COASTAL SALT MARSHES, ESPECIALLY AT THE TIMES WHEN PEAT MARSHES BEGIN TO BE TRANSGRESSED. FEAT DOMES NOT YET FULLY COLLAPSED MAY HAVE PROVIDED VANTAGE POINTS FOR SEASONAL OCUPANCY OR EVEN SETTLEMENT FROM WHICH THE RICHER RESOURCE OF THE MINERALOGENIC MARSHES DEVELOPING ON LOWER GROUND COULD BE EXPLOITED. INCREASING HUMAN INTERFERENCE ON SALT MARSHES OVER THE LAST MILLENNIUM, CHIEFLY THROUGH WHOLESALE LAND-CLAIM AND SET-BACK, AUGMENTED BY RISING SEA LEVELS AND CONTINUING AUTOCOMPACTION, HAS LED TO A VARIETY OF POORLY UNDERSTOOD BUT GENERALLY DELETERIOUS EFFECTS IN THE LOWLAND COASTAL ZONE. THESE INCLUDE MAJOR CHANGES TO TIDAL AND SEDIMENTARY REGIMES. (C) 2000 ELSEVIER SCIENCE LTD. ALL RIGHTS RESERVED.","MORPHODYNAMICS OF HOLOCENE SALT MARSHES: A REVIEW SKETCH FROM THE ATLANTIC AND SOUTHERN NORTH SEA COASTS OF EUROPE","QUATERNARY SCIENCE REVIEWS","REVIEW","AUG",2000,"10.1016/S0277-3791(99)00034-7","GEOGRAPHY, PHYSICAL; GEOSCIENCES, MULTIDISCIPLINARY","WOS:000088333600002"
"FREIBAUER A, 2004, GEODERMA","FREIBAUER A;ROUNSEVELL MDA;SMITH P;VERHAGEN J","IN THIS REVIEW, TECHNICAL AND ECONOMICALLY VIABLE POTENTIALS FOR CARBON SEQUESTRATION IN THE AGRICULTURAL SOILS OF EUROPE BY 2008-2012 ARE ANALYSED AGAINST A BUSINESS-AS-USUAL SCENARIO. WE PROVIDE A QUANTITATIVE ESTIMATION OF THE CARBON ABSORPTION POTENTIAL PER HECTARE AND THE SURFACE OF AGRICULTURAL LAND THAT IS AVAILABLE AND SUITABLE FOR THE IMPLEMENTATION OF THOSE MEASURES, THEIR ENVIRONMENTAL EFFECTS AS WELL AS THE EFFECTS ON FARM INCOME. REALISTICALLY, AGRICULTURAL SOILS IN EU-15 CAN SEQUESTER UP TO 16-19 MT C YEAR(-1) DURING THE FIRST KYOTO COMMITMENT PERIOD (2008-2012), WHICH IS LESS THAN ONE FIFTH OF THE THEORETICAL POTENTIAL AND EQUIVALENT TO 2% OF EUROPEAN ANTHROPOGENIC EMISSIONS. WE IDENTIFIED AS MOST PROMISING MEASURES: THE PROMOTION OF ORGANIC INPUTS ON ARABLE LAND INSTEAD OF GRASSLAND, THE INTRODUCTION OF PERENNIALS (GRASSES, TREES) ON ARABLE SET-ASIDE LAND FOR CONSERVATION OR BIOFUEL PURPOSES, TO PROMOTE ORGANIC FARMING, TO RAISE THE WATER TABLE IN FANNED PEATLAND, AND-WITH RESTRICTIONS-ZERO TILLAGE OR CONSERVATION TILLAGE. MANY OPTIONS HAVE ENVIRONMENTAL BENEFITS BUT SOME RISK OF INCREASING N2O EMISSIONS. FOR MOST MEASURES IT IS IMPOSSIBLE TO DETERMINE THE OVERALL IMPACT ON FARM PROFITABILITY. EFFICIENT CARBON SEQUESTRATION IN AGRICULTURAL SOILS DEMANDS A PERMANENT MANAGEMENT CHANGE AND IMPLEMENTATION CONCEPTS ADJUSTED TO LOCAL SOIL, CLIMATE AND MANAGEMENT FEATURES IN ORDER TO ALLOW SELECTION OF AREAS WITH HIGH CARBON SEQUESTERING POTENTIAL. SOME OF THE PRESENT AGRICULTURAL POLICY SCHEMES HAVE PROBABLY HELPED TO MAINTAIN CARBON STOCKS IN AGRICULTURAL SOILS. (C) 2004 ELSEVIER B.V. ALL RIGHTS RESERVED.","CARBON SEQUESTRATION IN THE AGRICULTURAL SOILS OF EUROPE","GEODERMA","REVIEW","SEP",2004,"10.1016/j.geoderma.2004.01.021","SOIL SCIENCE","WOS:000223108100001"
"WARD CR, 2002, INT J COAL GEOL","WARD CR","THE MATERIAL DESCRIBED AS ""MINERAL MATTER"" IN COAL ENCOMPASSES DISSOLVED SALTS IN THE PORE WATER AND INORGANIC ELEMENTS ASSOCIATED WITH THE ORGANIC COMPOUNDS, AS WELL AS DISCRETE CRYSTALLINE AND NON-CRYSTALLINE MINERAL PARTICLES. A RANGE OF TECHNOLOGIES, INCLUDING BUT NOT RESTRICTED TO LOW-TEMPERATURE OXYGEN-PLASMA ASHING, MAY BE USED TO EVALUATE THE TOTAL PROPORTIONS OF MINERALS AND OTHER INORGANIC CONSTITUENTS IN A COAL SAMPLE. THE RELATIVE PROPORTIONS OF THE INDIVIDUAL MINERALS IN THE COAL MAY BE FURTHER DETERMINED BY SEVERAL DIFFERENT TECHNIQUES, INCLUDING RIETVELD-BASED X-RAY POWDER DIFFRACTOMETRY, COMPUTER-CONTROLLED SCANNING ELECTRON MICROSCOPY (CCSEM), AND NON-NATIVE INTERPRETATION OF CHEMICAL ANALYSIS DATA. THE MODE OF OCCURRENCE OF PARTICULAR MINERALS MAY BE EVALUATED BY OPTICAL OR ELECTRON MICROSCOPY TECHNIQUES. THE MINERALS IN COAL MAY REPRESENT TRANSFORMED ACCUMULATIONS OF BIOGENIC CONSTITUENTS SUCH AS PHYTOLITHS AND SKELETAL FRAGMENTS, OR THEY MAY BE OF DETRITAL ORIGIN, INTRODUCED AS EPICLASTIC OR PYROCLASTIC PARTICLES INTO THE PEAT BED. OTHER MINERALS ARE PRODUCED BY AUTHIGENIC PRECIPITATION, EITHER SYNGENETICALLY WITH PEAT ACCUMULATION OR AT A LATER STAGE IN CLEATS AND OTHER PORE SPACES BY EPIGENETIC PROCESSES. THEY MAY REPRESENT SOLUTION AND REPRECIPITATION PRODUCTS OF BIOGENIC AND DETRITAL MATERIAL, OR THEY MAY BE DERIVED FROM SOLUTIONS OR DECAYING ORGANIC MATTER WITHIN THE PEAT BED. NON-MINERAL INORGANICS MAY BE DERIVED FROM A RANGE OF SUBSURFACE WATERS, AND POSSIBLY REDISTRIBUTED WITHIN LOW-RANK SEAMS BY POST-DEPOSITIONAL ION MIGRATION EFFECTS. THEY MAY ALSO BE EXPELLED IN DIFFERENT WAYS FROM THE ORGANIC MATTER WITH RANK ADVANCE. QUANTITATIVE ANALYSIS OF MINERALS AND OTHER INORGANICS CONTRIBUTES SIGNIFICANTLY TO DEFINING COAL QUALITY. IT MAY ALSO BE USEFUL AS AN AID TO STRATIGRAPHIC CORRELATION, EITHER BETWEEN SEAMS IN A COAL-BEARING SEQUENCE OR BETWEEN SUB-SECTIONS WITHIN AN INDIVIDUAL COAL BED. MINERALOGICAL ANALYSIS MAY HELP IN IDENTIFYING THE MODE OF OCCURRENCE AND MOBILITY OF PARTICULAR TRACE ELEMENTS, INCLUDING POTENTIALLY TOXIC COMPONENTS SUCH AS ARSENIC AND MERCURY. KNOWLEDGE OF THE MINERAL MATTER CAN ALSO BE USED TO EVALUATE THE BEHAVIOUR OF PARTICULAR COALS IN DIFFERENT UTILIZATION PROCESSES, INCLUDING THE PROCESSES THAT CONTROL THE CHARACTERISTICS OF FLY ASHES, STAGS AND OTHER COMBUSTION BY-PRODUCTS. (C) 2002 ELSEVIER SCIENCE B.V. ALL RIGHTS RESERVED.","ANALYSIS AND SIGNIFICANCE OF MINERAL MATTER IN COAL SEAMS","INTERNATIONAL JOURNAL OF COAL GEOLOGY","REVIEW","MAY",2002,"10.1016/S0166-5162(02)00117-9","ENERGY & FUELS; GEOSCIENCES, MULTIDISCIPLINARY","WOS:000179067600007"
"BRIDGHAM SD, 2006, WETLANDS","BRIDGHAM SD;MEGONIGAL JP;KELLER JK;BLISS NB;TRETTIN C","WE EXAMINE THE CARBON BALANCE OF NORTH AMERICAN WETLANDS BY REVIEWING AND SYNTHESIZING THE PUBLISHED LITERATURE AND SOIL DATABASES. NORTH AMERICAN WETLANDS CONTAIN ABOUT 220 PG C, MOST OF WHICH IS IN PEAT. THEY ARE A SMALL TO MODERATE CARBON SINK OF ABOUT 49 TG C YR(-1), ALTHOUGH THE UNCERTAINTY AROUND THIS ESTIMATE IS GREATER THAN 100%, WITH THE LARGEST UNKNOWN BEING THE ROLE OF CARBON SEQUESTRATION BY SEDIMENTATION IN FRESHWATER MINERAL-SOIL WETLANDS. WE ESTIMATE THAT NORTH AMERICAN WETLANDS EMIT 9 TG METHANE (CH4) YR(-1); HOWEVER, THE UNCERTAINTY OF THIS ESTIMATE IS ALSO GREATER THAN 100%. WITH THE EXCEPTION OF ESTUARINE WETLANDS, CH4 EMISSIONS FROM WETLANDS MAY LARGELY OFFSET ANY POSITIVE BENEFITS OF CARBON SEQUESTRATION IN SOILS AND PLANTS IN TERMS OF CLIMATE FORCING. HISTORICALLY, THE DESTRUCTION OF WETLANDS THROUGH LAND-USE CHANGES HAS HAD THE LARGEST EFFECTS ON THE CARBON FLUXES AND CONSEQUENT RADIATIVE FORCING OF NORTH AMERICAN WETLANDS. THE PRIMARY EFFECTS HAVE BEEN A REDUCTION IN THEIR ABILITY TO SEQUESTER CARBON (A SMALL TO MODERATE INCREASE IN RADIATIVE FORCING), OXIDATION OF THEIR SOIL CARBON RESERVES UPON DRAINAGE (A SMALL INCREASE IN RADIATIVE FORCING), AND REDUCTION IN CH4 EMISSIONS (A SMALL TO LARGE DECREASE IN RADIATIVE FORCING). IT IS UNCERTAIN HOW GLOBAL CHANGES WILL AFFECT THE CARBON POOLS AND FLUXES OF NORTH AMERICAN WETLANDS. WE WILL NOT BE ABLE TO PREDICT ACCURATELY THE ROLE OF WETLANDS AS POTENTIAL POSITIVE OR NEGATIVE FEEDBACKS TO ANTHROPOGENIC GLOBAL CHANGE WITHOUT KNOWING THE INTEGRATIVE EFFECTS OF CHANGES IN TEMPERATURE, PRECIPITATION, ATMOSPHERIC CARBON DIOXIDE CONCENTRATIONS, AND ATMOSPHERIC DEPOSITION OF NITROGEN AND SULFUR ON THE CARBON BALANCE OF NORTH AMERICAN WETLANDS.","THE CARBON BALANCE OF NORTH AMERICAN WETLANDS","WETLANDS","REVIEW","DEC",2006,"10.1672/0277-5212(2006)26[889:TCBONA]2.0.CO;2","ECOLOGY; ENVIRONMENTAL SCIENCES","WOS:000243370000002"
"LIMPENS J, 2008, BIOGEOSCIENCES","LIMPENS J;BERENDSE F;BLODAU C;CANADELL JG;FREEMAN C;HOLDEN J;ROULET N;RYDIN H;SCHAEPMAN-STRUB G","PEATLANDS COVER ONLY 3% OF THE EARTH'S LAND SURFACE BUT BOREAL AND SUBARCTIC PEATLANDS STORE ABOUT 15-30% OF THE WORLD'S SOIL CARBON ( C) AS PEAT. DESPITE THEIR POTENTIAL FOR LARGE POSITIVE FEEDBACKS TO THE CLIMATE SYSTEM THROUGH SEQUESTRATION AND EMISSION OF GREENHOUSE GASES, PEATLANDS ARE NOT EXPLICITLY INCLUDED IN GLOBAL CLIMATE MODELS AND THEREFORE IN PREDICTIONS OF FUTURE CLIMATE CHANGE. IN APRIL 2007 A SYMPOSIUM WAS HELD IN WAGENINGEN, THE NETHERLANDS, TO ADVANCE OUR UNDERSTANDING OF PEATLAND C CYCLING. THIS PAPER SYNTHESIZES THE MAIN FINDINGS OF THE SYMPOSIUM, FOCUSING ON (I) SMALL-SCALE PROCESSES, (II) C FLUXES AT THE LANDSCAPE SCALE, AND (III) PEATLANDS IN THE CONTEXT OF CLIMATE CHANGE. THE MAIN DRIVERS CONTROLLING MOST ARE RELATED TO SOME ASPECTS OF HYDROLOGY. DESPITE HIGH SPATIAL AND ANNUAL VARIABILITY IN NET ECOSYSTEM EXCHANGE ( NEE), THE DIFFERENCES IN CUMULATIVE ANNUAL NEE ARE MORE A FUNCTION OF BROAD SCALE GEOGRAPHIC LOCATION AND PHYSICAL SETTING THAN INTERNAL FACTORS, SUGGESTING THE EXISTENCE OF STRONG FEEDBACKS. IN CONTRAST, TRACE GAS EMISSIONS SEEM MAINLY CONTROLLED BY LOCAL FACTORS. KEY UNCERTAINTIES REMAIN CONCERNING THE EXISTENCE OF PERTURBATION THRESHOLDS, THE RELATIVE STRENGTHS OF THE CO2 AND CH4 FEEDBACK, THE LINKS AMONG PEATLAND SURFACE CLIMATE, HYDROLOGY, ECOSYSTEM STRUCTURE AND FUNCTION, AND TRACE GAS BIOGEOCHEMISTRY AS WELL AS THE SIMILARITY OF PROCESS RATES ACROSS PEATLAND TYPES AND CLIMATIC ZONES. PROGRESS ON THESE RESEARCH AREAS CAN ONLY BE REALIZED BY STRONGER CO-OPERATION BETWEEN DISCIPLINES THAT ADDRESS DIFFERENT SPATIAL AND TEMPORAL SCALES.","PEATLANDS AND THE CARBON CYCLE: FROM LOCAL PROCESSES TO GLOBAL IMPLICATIONS - A SYNTHESIS","BIOGEOSCIENCES","REVIEW",NA,2008,"10.5194/bg-5-1475-2008","ECOLOGY; GEOSCIENCES, MULTIDISCIPLINARY","WOS:000260557000005"
"GUSEWELL S, 2002, PERSPECT PLANT ECOL","GUSEWELL S;KOERSELMAN M","THE USE OF NUTRIENT CONCENTRATIONS IN PLANT BIOMASS AS EASILY MEASURED INDICATORS OF NUTRIENT AVAILABILITY AND LIMITATION HAS BEEN THE SUBJECT OF A CONTROVERSIAL DEBATE. IN PARTICULAR, IT HAS BEEN QUESTIONED WHETHER NUTRIENT CONCENTRATIONS ARE MAINLY SPECIES' TRAITS OR MAINLY DETERMINED BY NUTRIENT AVAILABILITY, AND WHETHER PLANT SPECIES HAVE SIMILAR OR DIFFERENT RELATIVE NUTRIENT REQUIREMENTS. THIS REVIEW EXAMINES HOW NITROGEN AND PHOSPHORUS CONCENTRATION AND THE N:P RATIO IN WETLAND PLANTS VARY AMONG SPECIES AND SITES, AND HOW THEY ARE RELATED TO NUTRIENT AVAILABILITY AND LIMITATION. WE ANALYSE DATA FROM FIELD STUDIES IN EUROPEAN NON-FORESTED WETLANDS, FROM FERTILISATION EXPERIMENTS IN THESE COMMUNITIES AND FROM GROWTH EXPERIMENTS WITH WETLAND PLANTS. OVERALL, THE P CONCENTRATION WAS MORE VARIABLE THAN THE N CONCENTRATION, WHILE VARIATION IN NT RATIOS WAS INTERMEDIATE. FIELD DATA SHOWED THAT THE N CONCENTRATION VARIES MORE AMONG SPECIES THAN AMONG SITES, WHEREAS THE N:P RATIO VARIES MORE AMONG SITES THAN AMONG SPECIES, AND THE P CONCENTRATION VARIES SIMILARLY AMONG BOTH. SIMILAR PATTERNS OF VARIATION WERE FOUND IN FERTILISATION EXPERIMENTS AND IN GROWTH EXPERIMENTS UNDER CONTROLLED NUTRIENT SUPPLY. NUTRIENT CONCENTRATIONS AND N:P RATIOS IN THE VEGETATION WERE POORLY CORRELATED WITH VARIOUS MEASURES OF NUTRIENT AVAILABILITY IN SOIL, BUT THEY CLEARLY RESPONDED TO FERTILISATION IN THE FIELD AND TO NUTRIENT SUPPLY IN GROWTH EXPERIMENTS. IN THESE EXPERIMENTS, BIOMASS N:P RATIOS RANGED FROM 3 TO 40 AND PRIMARILY REFLECTED THE RELATIVE AVALLABILITIES OF N AND P, ALTHOUGH NT RATIOS OF PLANTS GROWN AT THE SAME NUTRIENT SUPPLY COULD VARY THREE-FOLD AMONG SPECIES. THE EFFECTS OF FERTILISATION WITH N OR P ON THE BIOMASS PRODUCTION OF WETLAND VEGETATION WERE WELL RELATED TO THE N:P RATIOS OF THE VEGETATION IN UNFERTILISED PLOTS, BUT NOT TO N OR P CONCENTRATIONS, WHICH SUPPORTS THE IDEA THAT NT RATIOS, RATHER THAN N OR P CONCENTRATIONS, INDICATE THE TYPE OF NUTRIENT LIMITATION. HOWEVER, OTHER LIMITING OR STRESSING FACTORS MAY INFLUENCE N:P RATIOS, AND THE RESPONSES OF INDIVIDUAL PLANT SPECIES TO FERTILISATION CANNOT BE PREDICTED FROM THEIR N:P RATIOS. THEREFORE, NT RATIOS SHOULD ONLY BE USED TO ASSESS WHICH NUTRIENT LIMITS THE BIOMASS PRODUCTION AT THE VEGETATION LEVEL AND ONLY WHEN FACTORS OTHER THAN N OR P ARE UNLIKELY TO BE LIMITING.","VARIATION IN NITROGEN AND PHOSPHORUS CONCENTRATIONS OF WETLAND PLANTS","PERSPECTIVES IN PLANT ECOLOGY EVOLUTION AND SYSTEMATICS","REVIEW",NA,2002,"10.1078/1433-8319-0000022","PLANT SCIENCES; ECOLOGY","WOS:000177040800004"
"WHEELER BD, 2000, J ECOL","WHEELER BD;PROCTOR MCF","1 THE HISTORICAL DEVELOPMENT OF MIRE ECOLOGY AND TERMINOLOGY IS REVIEWED IN RELATION TO EVOLVING CONCEPTS AND PERCEPTIONS, AND THE DIVERSE SCHOOLS AND TRADITIONS OF VEGETATION AND HABITAT DESCRIPTION AND RESEARCH. 2 MOST ECOLOGICAL AND FLORISTIC VARIATION WITHIN NORTH-WEST EUROPEAN MIRE VEGETATION IS ACCOUNTED FOR BY THREE ECOLOGICAL GRADIENTS: THE ACID BASE-POOR VS. NEUTRAL, BASE- AND BICARBONATE-RICH GRADIENT; THE GRADIENT IN FERTILITY RELATED TO AVAILABILITY OF THE LIMITING NUTRIENT ELEMENTS N AND P; AND THE WATER LEVEL GRADIENT. EFFECTS OF SALINITY AND THE SPRING-FLUSH-FEN GRADIENTS ARE OF MORE LOCAL SIGNIFICANCE, USUALLY EASILY RECOGNIZED. LAND USE IS AN IMPORTANT ADDITIONAL FACTOR. 3 THE MINERAL-SOIL-WATER LIMIT BETWEEN OMBROTROPHIC AND MINEROTROPHICALLY INFLUENCED SITES IS NOT SHARP, AND CANNOT BE RELATED TO CONSISTENT DIFFERENCES IN EITHER VEGETATION OR WATER CHEMISTRY. IT SHOULD BE ABANDONED AS A GENERAL MAIN DIVISION WITHIN MIRES. 4 THE MOST IMPORTANT NATURAL DIVISION IS BETWEEN 'BOG', WITH PH GENERALLY < 5.0, LOW CA2+, AND CL- AND SO42- AS THE MAIN INORGANIC ANIONS, TYPICALLY DOMINATED BY SPHAGNA, ERICOIDS AND CALCIFUGE CYPERACEAE, AND 'FEN', WITH PH GENERALLY > 6.0, HIGH CA2+ AND HCO3-, VEGETATION RICH IN DICOTYLEDONOUS HERBS AND 'BROWN MOSSES'. THIS DIVISION IS REFLECTED IN A BIMODAL DISTRIBUTION OF PH. 5 THE TERMS OLIGOTROPHIC, MESOTROPHIC AND EUTROPHIC SHOULD REFER ONLY TO NUTRIENT RICHNESS (FERTILITY, MAINLY N AND P), NOT TO BASE RICHNESS (METALLIC CATIONS AND PH). 6 IT IS RECOMMENDED THAT 'MIRE' SHOULD EMBRACE BOTH WETLANDS ON PEAT AND RELATED COMMUNITIES ON MINERAL SOILS, THAT 'BOG' (UNQUALIFIED) SHOULD ENCOMPASS BOTH OMBROTROPHIC AND WEAKLY MINEROTROPHIC MIRES, INCLUDING 'BOG WOODLAND', AND THAT 'FEN' SHOULD BE RESTRICTED TO BASE-RICH MIRES BUT INCLUDE BOTH HERBACEOUS AND WOODED VEGETATION ('FEN CARR'). 7 DEFINITIONS ARE GIVEN FOR A RANGE OF BROADLY DEFINED CATEGORIES THAT SHOULD COVER MOST VEGETATION TYPES COMMONLY ENCOUNTERED. THE RELATION OF THESE TO BRITISH NATIONAL VEGETATION CLASSIFICATION TYPES AND TO MAJOR UNITS IN EUROPEAN PHYTOSOCIOLOGY IS OUTLINED.","ECOLOGICAL GRADIENTS, SUBDIVISIONS AND TERMINOLOGY OF NORTH-WEST EUROPEAN MIRES","JOURNAL OF ECOLOGY","REVIEW","APR",2000,"10.1046/j.1365-2745.2000.00455.x","PLANT SCIENCES; ECOLOGY","WOS:000086271800001"
"KAYRANLI B, 2010, WETLANDS","KAYRANLI B;SCHOLZ M;MUSTAFA A;HEDMARK A","WE CRITICALLY REVIEW RECENT LITERATURE ON CARBON STORAGE AND FLUXES WITHIN NATURAL AND CONSTRUCTED FRESHWATER WETLANDS, AND SPECIFICALLY ADDRESS CONCERNS OF READERS WORKING IN APPLIED SCIENCE AND ENGINEERING. OUR PURPOSE IS TO REVIEW AND ASSESS THE DISTRIBUTION AND CONVERSION OF CARBON IN THE WATER ENVIRONMENT, PARTICULARLY WITHIN WETLAND SYSTEMS. A KEY AIM IS TO ASSESS IF WETLANDS ARE CARBON SINKS OR SOURCES. CARBON SEQUESTRATION AND FLUXES IN NATURAL AND CONSTRUCTED WETLANDS LOCATED AROUND THE WORLD HAS BEEN ASSESSED. ALL FACETS OF CARBON (SOLID AND GASEOUS FORMS) HAVE BEEN COVERED. WE DRAW CONCLUSIONS BASED ON THESE STUDIES. FINDINGS INDICATE THAT WETLANDS CAN BE BOTH SOURCES AND SINKS OF CARBON, DEPENDING ON THEIR AGE, OPERATION, AND THE ENVIRONMENTAL BOUNDARY CONDITIONS SUCH AS LOCATION AND CLIMATE. SUGGESTIONS FOR FURTHER RESEARCH NEEDS IN THE AREA OF CARBON STORAGE IN WETLAND SEDIMENTS ARE OUTLINED TO FACILITATE THE UNDERSTANDING OF THE PROCESSES OF CARBON STORAGE AND REMOVAL AND ALSO THE FACTORS THAT INFLUENCE THEM.","CARBON STORAGE AND FLUXES WITHIN FRESHWATER WETLANDS: A CRITICAL REVIEW","WETLANDS","REVIEW","FEB",2010,"10.1007/s13157-009-0003-4","ECOLOGY; ENVIRONMENTAL SCIENCES","WOS:000275642500010"
"GRIGAL DF, 2003, J ENVIRON QUAL","GRIGAL DF","NEARLY ALL HG IN VEGETATION IS DERIVED DIRECTLY FROM THE ATMOSPHERE. MASS OF HG IN FOREST VEGETATION (ROUGHLY 0.1 MG M(-2)) IS ABOUT AN ORDER OF MAGNITUDE SMALLER THAN THAT IN THE FOREST FLOOR (1 MG M(-2)) AND TWO ORDERS OF MAGNITUDE SMALLER THAN THAT IN THE MINERAL SOIL (10 MG M(-2)). MASS OF HG IN PEAT (20 MG M(-2)) IS GREATER THAN THE SUM OF THAT IN MINERAL SOIL AND THE FOREST FLOOR; WETLANDS USUALLY SEQUESTER MORE HG THAN ASSOCIATED UPLANDS. THE STRONG RELATIONSHIP OF HG TO ORGANIC MATTER, ASSOCIATED WITH BINDING BY REDUCED S GROUPS, IS FUNDAMENTAL TO UNDERSTANDING HG DISTRIBUTION AND BEHAVIOR IN TERRESTRIAL SYSTEMS. THE STOICHIOMETRY OF THE HG-C RELATIONSHIP VARIES; HG-S RELATIONSHIPS, THOUGH LESS VARIABLE, ARE NOT CONSTANT. BECAUSE OF THE HG-ORGANIC MATTER LINK, LANDSCAPE CONDITIONS THAT LEAD TO DIFFERENTIAL SOIL ORGANIC MATTER ACCUMULATION ARE LIKELY TO LEAD TO DIFFERENTIAL HG ACCUMULATION. THE RATIO OF METHYLMERCURY (MEHG) TO TOTAL HG IS GENERALLY LOW IN BOTH VEGETATION (NEAR 1.5%) AND SOIL (< 1%), BUT AREAS OF POORLY DRAINED SOILS AND WETLANDS ARE SITES OF MEHG PRODUCTION. THE ANNUAL EMISSION OF ANTHROPIC HG FROM THE 48;CONTIGUOUS STATES OF THE USA (144 MG) IS TWO ORDERS OF MAGNITUDE LESS THAN THE POOL OF HG IN FORESTS OF THOSE STATES (30 300 MG). PEATTANDS, LESS THAN 2% OF TOTAL LAND AREA, SEQUESTER MORE THAN 20 TIMES ANNUAL EMISSIONS (2930 MG). IF GLOBAL CLIMATE CHANGE AFFECTS C STORAGE IT WILL INDIRECTLY AFFECT HG STORAGE, HAVING A MAJOR EFFECT ON THE BALANCE BETWEEN EMISSIONS AND SEQUESTRATION AND ON THE GLOBAL HG CYCLE.","MERCURY SEQUESTRATION IN FORESTS AND PEATLANDS: A REVIEW","JOURNAL OF ENVIRONMENTAL QUALITY","REVIEW","MAR-APR",2003,NA,"ENVIRONMENTAL SCIENCES","WOS:000181618300002"
